Provider,FilePath,Tags,RelatedUrl,ServiceName,Description,Categories,Notes,CheckTitle,CheckAliases,DependsOn,SubServiceName,CheckType,CheckID,Remediation,Severity,RelatedTo,ResourceIdTemplate,ResourceType,Risk
aws,/Users/apple/Desktop/github/prowler/providers/aws/services/cloudfront/cloudfront_distributions_origin_traffic_encrypted/cloudfront_distributions_origin_traffic_encrypted.metadata.json,,https://docs.aws.amazon.com/whitepapers/latest/secure-content-delivery-amazon-cloudfront/custom-origin-with-cloudfront.html,cloudfront,Check if CloudFront distributions encrypt traffic to custom origins.,[],,Check if CloudFront distributions encrypt traffic to custom origins.,,[],,[],cloudfront_distributions_origin_traffic_encrypted,"{'Code': {'CLI': '', 'NativeIaC': '', 'Other': 'https://docs.aws.amazon.com/securityhub/latest/userguide/cloudfront-controls.html#cloudfront-9', 'Terraform': 'https://www.trendmicro.com/cloudoneconformity/knowledge-base/aws/CloudFront/cloudfront-traffic-to-origin-unencrypted.html'}, 'Recommendation': {'Text': 'Configure your CloudFront distributions to require HTTPS (TLS) for traffic to custom origins, ensuring all data transmitted between CloudFront and the origin is encrypted and protected from unauthorized access.', 'Url': 'https://docs.aws.amazon.com/AmazonCloudFront/latest/DeveloperGuide/using-https-cloudfront-to-custom-origin.html'}}",medium,[],arn:partition:cloudfront:region:account-id:distribution/resource-id,AWSCloudFrontDistribution,"Allowing unencrypted HTTP traffic between CloudFront and custom origins can expose data to potential eavesdropping and manipulation, compromising data security and integrity."
aws,/Users/apple/Desktop/github/prowler/providers/aws/services/cloudfront/cloudfront_distributions_default_root_object/cloudfront_distributions_default_root_object.metadata.json,,https://docs.aws.amazon.com/AmazonCloudFront/latest/DeveloperGuide/DefaultRootObject.html#DefaultRootObjectHow,cloudfront,Check if CloudFront distributions have a default root object.,[],,Check if CloudFront distributions have a default root object.,,[],,[],cloudfront_distributions_default_root_object,"{'Code': {'CLI': 'aws cloudfront update-distribution --id <distribution-id> --default-root-object <new-root-object>', 'NativeIaC': '', 'Other': 'https://docs.aws.amazon.com/securityhub/latest/userguide/cloudfront-controls.html#cloudfront-1', 'Terraform': 'https://www.trendmicro.com/cloudoneconformity/knowledge-base/aws/CloudFront/cloudfront-default-object.html'}, 'Recommendation': {'Text': ""Configure a default root object for your CloudFront distribution to ensure that a specific file (such as index.html) is returned when users access the root URL. This improves user experience and ensures that sensitive content isn't accidentally exposed."", 'Url': 'https://docs.aws.amazon.com/AmazonCloudFront/latest/DeveloperGuide/DefaultRootObject.html#DefaultRootObjectHowToDefine'}}",high,[],arn:partition:cloudfront:region:account-id:distribution/resource-id,AwsCloudFrontDistribution,"Without a default root object, requests to the root URL may result in an error or expose unintended content, leading to potential security risks and a poor user experience."
aws,/Users/apple/Desktop/github/prowler/providers/aws/services/cloudfront/cloudfront_distributions_using_waf/cloudfront_distributions_using_waf.metadata.json,,https://docs.aws.amazon.com/waf/latest/developerguide/cloudfront-features.html,cloudfront,Check if CloudFront distributions are using WAF.,[],,Check if CloudFront distributions are using WAF.,,[],,['IAM'],cloudfront_distributions_using_waf,"{'Code': {'CLI': '', 'NativeIaC': 'https://docs.prowler.com/checks/aws/general-policies/bc_aws_general_27#cloudformation', 'Other': 'https://docs.prowler.com/checks/aws/general-policies/bc_aws_general_27', 'Terraform': 'https://docs.prowler.com/checks/aws/general-policies/bc_aws_general_27#terraform'}, 'Recommendation': {'Text': 'Use AWS WAF to protect your service from common web exploits. These could affect availability and performance, compromise security, or consume excessive resources.', 'Url': 'https://www.trendmicro.com/cloudoneconformity/knowledge-base/aws/CloudFront/cloudfront-integrated-with-waf.html'}}",medium,[],arn:partition:cloudfront:region:account-id:distribution/resource-id,AwsCloudFrontDistribution,"Potential attacks and / or abuse of service, more even for even for internet reachable services."
aws,/Users/apple/Desktop/github/prowler/providers/aws/services/cloudfront/cloudfront_distributions_custom_ssl_certificate/cloudfront_distributions_custom_ssl_certificate.metadata.json,,https://aws.amazon.com/what-is/ssl-certificate/,cloudfront,Ensure that your Amazon CloudFront distributions are configured to use a custom SSL/TLS certificate instead of the default one.,['encryption'],,CloudFront distributions should use custom SSL/TLS certificates.,,[],,[],cloudfront_distributions_custom_ssl_certificate,"{'Code': {'CLI': '', 'NativeIaC': 'https://docs.prowler.com/checks/aws/networking-policies/ensure-aws-cloudfront-distribution-uses-custom-ssl-certificate/', 'Other': 'https://docs.aws.amazon.com/securityhub/latest/userguide/cloudfront-controls.html#cloudfront-7', 'Terraform': 'https://www.trendmicro.com/cloudoneconformity/knowledge-base/aws/CloudFront/cloudfront-distro-custom-tls.html'}, 'Recommendation': {'Text': 'Configure your CloudFront distributions to use a custom SSL/TLS certificate to enable secure access via your own domain names and meet specific security and branding needs. This allows for more control over encryption and authentication settings.', 'Url': 'https://docs.aws.amazon.com/AmazonCloudFront/latest/DeveloperGuide/CNAMEs.html#CreatingCNAME'}}",medium,[],arn:partition:service:region:account-id:resource-id,AwsCloudFrontDistribution,Using the default SSL/TLS certificate provided by CloudFront can limit your ability to use custom domain names and may not align with your organization's security policies or branding requirements.
aws,/Users/apple/Desktop/github/prowler/providers/aws/services/wafv2/wafv2_webacl_with_rules/wafv2_webacl_with_rules.metadata.json,,https://docs.aws.amazon.com/waf/latest/APIReference/API_Rule.html,wafv2,Check if AWS WAFv2 WebACL has at least one rule or rule group associated with it.,[],,Check if AWS WAFv2 WebACL has at least one rule or rule group.,,[],,['Software and Configuration Checks/Industry and Regulatory Standards/NIST 800-53 Controls'],wafv2_webacl_with_rules,"{'Code': {'CLI': 'aws wafv2 update-web-acl --id <web-acl-id> --scope <scope> --default-action <default-action> --rules <rules>', 'NativeIaC': 'https://docs.prowler.com/checks/aws/networking-policies/bc_aws_networking_64/', 'Other': 'https://docs.aws.amazon.com/securityhub/latest/userguide/waf-controls.html#waf-10', 'Terraform': ''}, 'Recommendation': {'Text': 'Ensure that each AWS WAF web ACL contains at least one rule or rule group to effectively manage and inspect incoming HTTP(S) web requests.', 'Url': 'https://docs.aws.amazon.com/waf/latest/developerguide/web-acl-editing.html'}}",medium,[],arn:partition:wafv2:region:account-id:webacl/webacl-id,AwsWafv2WebAcl,"An empty AWS WAF web ACL allows all web traffic to pass without inspection or control, exposing resources to potential security threats and attacks."
aws,/Users/apple/Desktop/github/prowler/providers/aws/services/wafv2/wafv2_webacl_logging_enabled/wafv2_webacl_logging_enabled.metadata.json,,https://docs.aws.amazon.com/waf/latest/developerguide/logging.html,wafv2,Check if AWS WAFv2 logging is enabled,['logging'],,Check if AWS WAFv2 WebACL logging is enabled,,[],,['Logging and Monitoring'],wafv2_webacl_logging_enabled,"{'Code': {'CLI': 'aws wafv2 update-web-acl-logging-configuration --scope REGIONAL --web-acl-arn arn:partition:wafv2:region:account-id:webacl/webacl-id --logging-configuration \'{""LogDestinationConfigs"": [""arn:partition:logs:region:account-id:log-group:log-group-name""]}\'', 'NativeIaC': 'https://docs.prowler.com/checks/aws/logging-policies/bc_aws_logging_33#terraform', 'Other': 'https://docs.aws.amazon.com/securityhub/latest/userguide/waf-controls.html#waf-11', 'Terraform': 'https://www.trendmicro.com/cloudoneconformity/knowledge-base/aws/WAF/enable-web-acls-logging.html'}, 'Recommendation': {'Text': 'Enable AWS WAFv2 logging for your Web ACLs to monitor and analyze traffic patterns effectively.', 'Url': 'https://docs.aws.amazon.com/waf/latest/developerguide/logging.html'}}",medium,[],arn:partition:wafv2:region:account-id:webacl/webacl-id,AwsWafv2WebAcl,Enabling AWS WAFv2 logging helps monitor and analyze traffic patterns for enhanced security.
aws,/Users/apple/Desktop/github/prowler/providers/aws/services/wafv2/wafv2_webacl_rule_logging_enabled/wafv2_webacl_rule_logging_enabled.metadata.json,,https://docs.aws.amazon.com/waf/latest/APIReference/API_UpdateRuleGroup.html,wafv2,This control checks whether an AWS WAF rule or rule group has Amazon CloudWatch metrics enabled. The control fails if the rule or rule group doesn't have CloudWatch metrics enabled.,['logging'],,Check if AWS WAFv2 WebACL rule or rule group has Amazon CloudWatch metrics enabled.,,[],,['Software and Configuration Checks/Industry and Regulatory Standards/NIST 800-53 Controls'],wafv2_webacl_rule_logging_enabled,"{'Code': {'CLI': 'aws wafv2 update-rule-group --id <rule-group-id> --scope <scope> --name <rule-group-name> --cloudwatch-metrics-enabled true', 'NativeIaC': '', 'Other': 'https://docs.aws.amazon.com/securityhub/latest/userguide/waf-controls.html#waf-12', 'Terraform': ''}, 'Recommendation': {'Text': 'Ensure that CloudWatch Metrics are enabled for AWS WAF rules and rule groups. This provides detailed insights into traffic, enabling timely identification of security risks.', 'Url': 'https://docs.aws.amazon.com/waf/latest/APIReference/API_UpdateWebACL.html'}}",medium,[],arn:partition:wafv2:region:account-id:webacl/webacl-id,AwsWafv2RuleGroup,"Without CloudWatch Metrics enabled on AWS WAF rules or rule groups, it's challenging to monitor traffic flow effectively. This reduces visibility into potential security threats, such as malicious activities or unusual traffic patterns."
aws,/Users/apple/Desktop/github/prowler/providers/aws/services/opensearch/opensearch_service_domains_internal_user_database_enabled/opensearch_service_domains_internal_user_database_enabled.metadata.json,,,opensearch,Check if Amazon Elasticsearch/Opensearch Service domains have internal user database enabled,[],,Check if Amazon Elasticsearch/Opensearch Service domains have internal user database enabled,,[],,"['Protect', 'Data protection']",opensearch_service_domains_internal_user_database_enabled,"{'Code': {'CLI': '', 'NativeIaC': '', 'Other': '', 'Terraform': ''}, 'Recommendation': {'Text': 'Remove users from internal user database and uso Cognito instead.', 'Url': 'https://docs.aws.amazon.com/elasticsearch-service/latest/developerguide/fgac.html'}}",medium,[],arn:partition:service:region:account-id:resource-id,AwsOpenSearchServiceDomain,"Internal User Database is convenient for demos, for production environment use Federated authentication."
aws,/Users/apple/Desktop/github/prowler/providers/aws/services/opensearch/opensearch_service_domains_audit_logging_enabled/opensearch_service_domains_audit_logging_enabled.metadata.json,,,opensearch,Check if Amazon Elasticsearch/Opensearch Service domains have audit logging enabled,"['forensics-ready', 'logging']",,Check if Amazon Elasticsearch/Opensearch Service domains have audit logging enabled,,[],,"['Identify', 'Logging']",opensearch_service_domains_audit_logging_enabled,"{'Code': {'CLI': '', 'NativeIaC': '', 'Other': '', 'Terraform': ''}, 'Recommendation': {'Text': 'Make sure you are logging information about Amazon Elasticsearch Service operations.', 'Url': 'https://docs.aws.amazon.com/elasticsearch-service/latest/developerguide/audit-logs.html'}}",low,[],arn:partition:service:region:account-id:resource-id,AwsOpenSearchServiceDomain,"If logs are not enabled, monitoring of service use and threat analysis is not possible."
aws,/Users/apple/Desktop/github/prowler/providers/aws/services/opensearch/opensearch_service_domains_encryption_at_rest_enabled/opensearch_service_domains_encryption_at_rest_enabled.metadata.json,,,opensearch,Check if Amazon Elasticsearch/Opensearch Service domains have encryption at-rest enabled,['encryption'],,Check if Amazon Elasticsearch/Opensearch Service domains have encryption at-rest enabled,,[],,"['Protect', 'Data protection', 'Encryption of data at rest']",opensearch_service_domains_encryption_at_rest_enabled,"{'Code': {'CLI': 'aws es update-elasticsearch-domain-config --domain-name <DOMAIN_NAME> --encryption-at-rest-options Enabled=true,KmsKeyId=<KMS_KEY_ID>', 'NativeIaC': 'https://docs.prowler.com/checks/aws/elasticsearch-policies/elasticsearch_3-enable-encryptionatrest#cloudformation', 'Other': 'https://www.trendmicro.com/cloudoneconformity/knowledge-base/aws/Elasticsearch/encryption-at-rest.html', 'Terraform': ''}, 'Recommendation': {'Text': 'Enable encryption at rest using AWS KMS to store and manage your encryption keys and the Advanced Encryption Standard algorithm with 256-bit keys (AES-256) to perform the encryption.', 'Url': 'https://docs.aws.amazon.com/elasticsearch-service/latest/developerguide/encryption-at-rest.html'}}",medium,[],arn:partition:service:region:account-id:resource-id,AwsOpenSearchServiceDomain,If not enable unauthorized access to your data could risk increases.
aws,/Users/apple/Desktop/github/prowler/providers/aws/services/opensearch/opensearch_service_domains_cloudwatch_logging_enabled/opensearch_service_domains_cloudwatch_logging_enabled.metadata.json,,,opensearch,Check if Amazon Elasticsearch/Opensearch Service domains have logging enabled,"['forensics-ready', 'logging']",,Check if Amazon Elasticsearch/Opensearch Service domains have logging enabled,,[],,"['Identify', 'Logging']",opensearch_service_domains_cloudwatch_logging_enabled,"{'Code': {'CLI': 'aws logs put-resource-policy --policy-name <POLICY_NAME> --policy-document <POLICY_DOC_JSON>', 'NativeIaC': 'https://docs.prowler.com/checks/aws/elasticsearch-policies/elasticsearch_7#cloudformation', 'Other': 'https://docs.prowler.com/checks/aws/elasticsearch-policies/elasticsearch_7', 'Terraform': 'https://docs.prowler.com/checks/aws/elasticsearch-policies/elasticsearch_7#terraform'}, 'Recommendation': {'Text': 'Enable Elasticsearch/Opensearch log. Create use cases for them. Using audit logs check for access denied events.', 'Url': 'https://docs.aws.amazon.com/elasticsearch-service/latest/developerguide/es-createdomain-configure-slow-logs.html'}}",medium,[],arn:partition:service:region:account-id:resource-id,AwsOpenSearchServiceDomain,"Amazon ES exposes four Elasticsearch/Opensearch logs through Amazon CloudWatch Logs: error logs, search slow logs, index slow logs, and audit logs."
aws,/Users/apple/Desktop/github/prowler/providers/aws/services/opensearch/opensearch_service_domains_access_control_enabled/opensearch_service_domains_access_control_enabled.metadata.json,,https://docs.aws.amazon.com/opensearch-service/latest/developerguide/fgac.html,opensearch,Check if Amazon Elasticsearch/Opensearch Service domains have fine grained access control enabled,[],,Check if Amazon Elasticsearch/Opensearch Service domains have fine grained access control enabled,,[],,[],opensearch_service_domains_access_control_enabled,"{'Code': {'CLI': '', 'NativeIaC': '', 'Other': 'https://docs.aws.amazon.com/securityhub/latest/userguide/opensearch-controls.html#opensearch-7', 'Terraform': ''}, 'Recommendation': {'Text': 'Enable fine grained access control for your OpenSearch domains', 'Url': 'https://docs.aws.amazon.com/opensearch-service/latest/developerguide/fgac.html#fgac-enabling'}}",high,[],arn:partition:service:region:account-id:resource-id,AwsOpenSearchServiceDomain,"Amazon ES's fine graine access control enhances security by verifying that access to OpenSearch domains is controlled at a granular level, allowing for more precise permissions management and reducing the risk of unauthorised access."
aws,/Users/apple/Desktop/github/prowler/providers/aws/services/opensearch/opensearch_service_domains_use_cognito_authentication_for_kibana/opensearch_service_domains_use_cognito_authentication_for_kibana.metadata.json,,,opensearch,Check if Amazon Elasticsearch/Opensearch Service domains has Amazon Cognito or SAML authentication for Kibana enabled,[],,Check if Amazon Elasticsearch/Opensearch Service domains has either Amazon Cognito or SAML authentication for Kibana enabled,,[],,"['Identify', 'Logging']",opensearch_service_domains_use_cognito_authentication_for_kibana,"{'Code': {'CLI': '', 'NativeIaC': '', 'Other': '', 'Terraform': ''}, 'Recommendation': {'Text': 'If you do not configure Amazon Cognito or SAML authentication, you can still protect Kibana using an IP-based access policy and a proxy server or HTTP basic authentication.', 'Url': 'https://docs.aws.amazon.com/elasticsearch-service/latest/developerguide/es-ac.html'}}",high,[],arn:partition:service:region:account-id:resource-id,AwsOpenSearchServiceDomain,"Not enabling Amazon Cognito or SAML authentication for Kibana in AWS Elasticsearch/OpenSearch Service domains increases the likelihood of unauthorized access to sensitive data, potentially compromising system integrity."
aws,/Users/apple/Desktop/github/prowler/providers/aws/services/opensearch/opensearch_service_domains_fault_tolerant_master_nodes/opensearch_service_domains_fault_tolerant_master_nodes.metadata.json,,https://docs.aws.amazon.com/opensearch-service/latest/developerguide/managedomains-dedicatedmasternodes.html#dedicatedmasternodes-number,opensearch,OpenSearch Service uses dedicated master nodes to increase cluster stability. A minimum of three dedicated master nodes is recommended to ensure high availability.,['redundancy'],,OpenSearch Service Domain should have at least three dedicated master nodes,,[],,[],opensearch_service_domains_fault_tolerant_master_nodes,"{'Code': {'CLI': ""aws es update-elasticsearch-domain-config --region <region> --domain-name <name> --elasticsearch-cluster-config DedicatedMasterEnabled=true,DedicatedMasterType='<instance_type>',DedicatedMasterCount=3"", 'NativeIaC': '', 'Other': 'https://docs.aws.amazon.com/securityhub/latest/userguide/opensearch-controls.html#opensearch-11', 'Terraform': ''}, 'Recommendation': {'Text': 'Ensure that your OpenSearch Service domain has at least three dedicated master nodes', 'Url': 'https://docs.aws.amazon.com/opensearch-service/latest/developerguide/managedomains-dedicatedmasternodes.html#dedicatedmasternodes-number'}}",medium,[],arn:partition:es:region:account-id:domain/resource-id,AwsOpenSearchServiceDomain,"If a master node fails, the cluster may become unavailable."
aws,/Users/apple/Desktop/github/prowler/providers/aws/services/opensearch/opensearch_service_domains_https_communications_enforced/opensearch_service_domains_https_communications_enforced.metadata.json,,,opensearch,Check if Amazon Elasticsearch/Opensearch Service domains have enforce HTTPS enabled,['encryption'],,Check if Amazon Elasticsearch/Opensearch Service domains have enforce HTTPS enabled,,[],,"['Protect', 'Data protection', 'Encryption of data in transit']",opensearch_service_domains_https_communications_enforced,"{'Code': {'CLI': '', 'NativeIaC': 'https://docs.prowler.com/checks/aws/elasticsearch-policies/elasticsearch_6#fix---builtime', 'Other': 'https://docs.prowler.com/checks/aws/elasticsearch-policies/elasticsearch_6#aws-console', 'Terraform': ''}, 'Recommendation': {'Text': ""When creating ES Domains, enable 'Require HTTPS fo all traffic to the domain'"", 'Url': 'https://docs.aws.amazon.com/elasticsearch-service/latest/developerguide/es-createupdatedomains.html'}}",medium,[],arn:partition:service:region:account-id:resource-id,AwsOpenSearchServiceDomain,If not enable unauthorized access to your data could risk increases.
aws,/Users/apple/Desktop/github/prowler/providers/aws/services/opensearch/opensearch_service_domains_updated_to_the_latest_service_software_version/opensearch_service_domains_updated_to_the_latest_service_software_version.metadata.json,,,opensearch,Check if Amazon Elasticsearch/Opensearch Service domains have updates available,[],,Check if Amazon Elasticsearch/Opensearch Service domains have updates available,,[],,"['Detect', 'Vulnerability, patch, and version management']",opensearch_service_domains_updated_to_the_latest_service_software_version,"{'Code': {'CLI': 'aws es upgrade-elasticsearch-domain --domain-name <DOMAIN_NAME> --target-version <TARGET_VERSION> --perform-check-only', 'NativeIaC': '', 'Other': 'https://www.trendmicro.com/cloudoneconformity/knowledge-base/aws/Elasticsearch/version.html', 'Terraform': ''}, 'Recommendation': {'Text': 'The Notifications panel in the console is the easiest way to see if an update is available or check the status of an update. You can also receive these notifications through Amazon EventBridge. If you take no action on required updates, Amazon ES still updates your domain service software automatically after a certain timeframe (typically two weeks). In this situation, Amazon ES sends notifications when it starts the update and when the update is complete.', 'Url': 'https://docs.aws.amazon.com/elasticsearch-service/latest/developerguide/es-service-software.html'}}",low,[],arn:partition:service:region:account-id:resource-id,AwsOpenSearchServiceDomain,Amazon ES regularly releases system software updates that add features or otherwise improve your domains.
aws,/Users/apple/Desktop/github/prowler/providers/aws/services/opensearch/opensearch_service_domains_not_publicly_accessible/opensearch_service_domains_not_publicly_accessible.metadata.json,,,opensearch,Check if Amazon Opensearch/Elasticsearch domains are publicly accessible via their access policies.,['internet-exposed'],,Check if Amazon Opensearch/Elasticsearch domains are publicly accessible,,[],,['Effects/Data Exposure'],opensearch_service_domains_not_publicly_accessible,"{'Code': {'CLI': '', 'NativeIaC': '', 'Other': 'https://www.trendmicro.com/cloudoneconformity/knowledge-base/aws/Elasticsearch/domain-exposed.html', 'Terraform': ''}, 'Recommendation': {'Text': ""Modify the access policy attached to your Amazon OpenSearch domain and replace the 'Principal' element value (i.e. '*') with the ARN of the trusted AWS account. You can also add a Condition clause to the policy statement to limit the domain access to a specific (trusted) IP address/IP range only."", 'Url': 'https://docs.aws.amazon.com/elasticsearch-service/latest/developerguide/es-vpc.html'}}",critical,[],arn:partition:service:region:account-id:resource-id,AwsOpenSearchServiceDomain,Publicly accessible services could expose sensitive data to bad actors.
aws,/Users/apple/Desktop/github/prowler/providers/aws/services/opensearch/opensearch_service_domains_fault_tolerant_data_nodes/opensearch_service_domains_fault_tolerant_data_nodes.metadata.json,,https://docs.aws.amazon.com/opensearch-service/latest/developerguide/what-is.html,opensearch,This control checks whether Elasticsearch/Opensearch domains are fault-tolerant with at least three data nodes and cross-zone replication (Zone Awareness) enabled.,['redundancy'],,Ensure Elasticsearch/Opensearch domains have fault-tolerant data nodes.,,[],,['Software and Configuration Checks/AWS Security Best Practices'],opensearch_service_domains_fault_tolerant_data_nodes,"{'Code': {'CLI': 'aws opensearch update-domain-config --domain-name <domain-name> --cluster-config InstanceCount=3,ZoneAwarenessEnabled=true', 'NativeIaC': '', 'Other': 'https://docs.aws.amazon.com/securityhub/latest/userguide/es-controls.html#es-6', 'Terraform': ''}, 'Recommendation': {'Text': 'Modify the Elasticsearch/Opensearch domain to ensure at least three data nodes and enable cross-zone replication (Zone Awareness) for high availability and fault tolerance.', 'Url': 'https://docs.aws.amazon.com/opensearch-service/latest/developerguide/managedomains-multiaz.html'}}",medium,[],arn:partition:es:{region}:{account-id}:domain/{domain-name},AwsElasticsearchDomain,"Without at least three data nodes and without cross-zone replication (Zone Awareness), the Elasticsearch/Opensearch domain may not be fault-tolerant, leading to a higher risk of data loss or unavailability in case of node failure."
