Provider,FilePath,Tags,RelatedUrl,ServiceName,Description,Categories,Notes,CheckTitle,CheckAliases,DependsOn,SubServiceName,CheckType,CheckID,Remediation,Severity,RelatedTo,ResourceIdTemplate,ResourceType,Risk
aws,/Users/apple/Desktop/github/prowler/providers/aws/services/elbv2/elbv2_insecure_ssl_ciphers/elbv2_insecure_ssl_ciphers.metadata.json,,,elbv2,Check if Elastic Load Balancers have insecure SSL ciphers.,['encryption'],,Check if Elastic Load Balancers have insecure SSL ciphers.,,[],,['Data Protection'],elbv2_insecure_ssl_ciphers,"{'Code': {'CLI': 'aws elbv2 modify-listener --listener-arn <lb_arn> --ssl-policy ELBSecurityPolicy-TLS13-1-2-Ext2-2021-06', 'NativeIaC': '', 'Other': 'https://www.trendmicro.com/cloudoneconformity/knowledge-base/aws/ELBv2/security-policy.html', 'Terraform': 'https://docs.prowler.com/checks/aws/general-policies/bc_aws_general_43#terraform'}, 'Recommendation': {'Text': 'Use a Security policy with ciphers that are as strong as possible. Drop legacy and insecure ciphers.', 'Url': 'https://docs.aws.amazon.com/elasticloadbalancing/latest/application/create-https-listener.html#describe-ssl-policies'}}",medium,[],arn:partition:service:region:account-id:resource-id,AwsElbv2LoadBalancer,Using insecure ciphers could affect privacy of in transit information.
aws,/Users/apple/Desktop/github/prowler/providers/aws/services/elbv2/elbv2_internet_facing/elbv2_internet_facing.metadata.json,,,elbv2,Check for internet facing Elastic Load Balancers.,['internet-exposed'],,Check for internet facing Elastic Load Balancers.,,[],,['Data Protection'],elbv2_internet_facing,"{'Code': {'CLI': '', 'NativeIaC': '', 'Other': 'https://www.trendmicro.com/cloudoneconformity/knowledge-base/aws/ELBv2/internet-facing-load-balancers.html', 'Terraform': ''}, 'Recommendation': {'Text': 'Ensure the load balancer should be publicly accessible. If publicly exposed ensure a WAF ACL is implemented.', 'Url': 'https://docs.aws.amazon.com/waf/latest/developerguide/web-acl-associating-aws-resource.html'}}",medium,[],arn:partition:service:region:account-id:resource-id,AwsElbv2LoadBalancer,Publicly accessible load balancers could expose sensitive data to bad actors.
aws,/Users/apple/Desktop/github/prowler/providers/aws/services/elbv2/elbv2_ssl_listeners/elbv2_ssl_listeners.metadata.json,,https://docs.aws.amazon.com/securityhub/latest/userguide/elb-controls.html#elb-1,elbv2,Check if Elastic Load Balancers have SSL listeners.,['encryption'],,Check if Elastic Load Balancers have SSL listeners.,,[],,['Data Protection'],elbv2_ssl_listeners,"{'Code': {'CLI': 'aws elbv2 create-listener --load-balancer-arn <lb_arn> --protocol HTTPS --port 443 --ssl-policy <ssl_policy> --certificates CertificateArn=<certificate_arn>,IsDefault=true', 'NativeIaC': '', 'Other': 'https://docs.prowler.com/checks/aws/networking-policies/networking_36#aws-ec2-console', 'Terraform': ''}, 'Recommendation': {'Text': 'Scan for Load Balancers with HTTP or TCP listeners and understand the reason for each of them. Check if the listener can be implemented as TLS instead.', 'Url': 'https://docs.aws.amazon.com/elasticloadbalancing/latest/application/create-https-listener.html'}}",medium,[],arn:partition:service:region:account-id:resource-id,AwsElbv2LoadBalancer,Clear text communication could affect privacy of information in transit.
aws,/Users/apple/Desktop/github/prowler/providers/aws/services/elbv2/elbv2_deletion_protection/elbv2_deletion_protection.metadata.json,,,elbv2,Check if Elastic Load Balancers have deletion protection enabled.,[],,Check if Elastic Load Balancers have deletion protection enabled.,,[],,['Data Protection'],elbv2_deletion_protection,"{'Code': {'CLI': 'aws elbv2 modify-load-balancer-attributes --load-balancer-arn <lb_arn> --attributes Key=deletion_protection.enabled,Value=true', 'NativeIaC': '', 'Other': 'https://www.trendmicro.com/cloudoneconformity/knowledge-base/aws/ELBv2/deletion-protection.html', 'Terraform': 'https://docs.prowler.com/checks/aws/general-policies/bc_aws_networking_62#terraform'}, 'Recommendation': {'Text': 'Enable deletion protection attribute, this is not enabled by default.', 'Url': 'https://docs.aws.amazon.com/elasticloadbalancing/latest/application/application-load-balancers.html#deletion-protection'}}",medium,[],arn:partition:service:region:account-id:resource-id,AwsElbv2LoadBalancer,"If deletion protection is not enabled, the resource is not protected against deletion."
aws,/Users/apple/Desktop/github/prowler/providers/aws/services/elbv2/elbv2_listeners_underneath/elbv2_listeners_underneath.metadata.json,,,elbv2,Check if ELBV2 has listeners underneath.,[],,Check if ELBV2 has listeners underneath.,,[],,['Data Protection'],elbv2_listeners_underneath,"{'Code': {'CLI': '', 'NativeIaC': '', 'Other': '', 'Terraform': ''}, 'Recommendation': {'Text': 'Add listeners to Elastic Load Balancers V2.', 'Url': 'https://docs.aws.amazon.com/elasticloadbalancing/latest/application/load-balancer-listeners.html'}}",medium,[],arn:partition:service:region:account-id:resource-id,AwsElbv2LoadBalancer,The rules that are defined for a listener determine how the load balancer routes requests to its registered targets.
aws,/Users/apple/Desktop/github/prowler/providers/aws/services/securityhub/securityhub_enabled/securityhub_enabled.metadata.json,,https://docs.aws.amazon.com/securityhub/latest/userguide/securityhub-standards-enable-disable.html,securityhub,Check if Security Hub is enabled and its standard subscriptions.,[],,Check if Security Hub is enabled and its standard subscriptions.,,[],,['Logging and Monitoring'],securityhub_enabled,"{'Code': {'CLI': 'aws securityhub enable-security-hub --enable-default-standards', 'NativeIaC': '', 'Other': '', 'Terraform': ''}, 'Recommendation': {'Text': 'Security Hub is Regional. When you enable or disable a security standard, it is enabled or disabled only in the current Region or in the Region that you specify.', 'Url': 'https://docs.aws.amazon.com/securityhub/latest/userguide/securityhub-standards-enable-disable.html'}}",medium,[],arn:partition:securityhub:region:account-id:hub/hub-id,Other,AWS Security Hub gives you a comprehensive view of your security alerts and security posture across your AWS accounts.
aws,/Users/apple/Desktop/github/prowler/providers/aws/services/backup/backup_recovery_point_encrypted/backup_recovery_point_encrypted.metadata.json,,https://docs.aws.amazon.com/aws-backup/latest/devguide/encryption.html,backup,This control checks if an AWS Backup recovery point is encrypted at rest. The control fails if the recovery point isn't encrypted at rest.,['encryption'],,Check if AWS Backup recovery points are encrypted at rest.,,[],,['Software and Configuration Checks/AWS Security Best Practices'],backup_recovery_point_encrypted,"{'Code': {'CLI': 'aws backup update-backup-vault --backup-vault-name <backup_vault_name> --encryption-key-arn <kms_key_arn>', 'NativeIaC': '', 'Other': 'https://docs.aws.amazon.com/securityhub/latest/userguide/backup-controls.html#backup-1', 'Terraform': ''}, 'Recommendation': {'Text': 'Ensure that AWS Backup recovery points are encrypted at rest by using an AWS KMS key when creating backups.', 'Url': 'https://docs.aws.amazon.com/aws-backup/latest/devguide/encryption.html'}}",medium,[],arn:aws:backup:region:account-id:recovery-point/recovery-point-id,AwsBackupRecoveryPoint,"Without encryption at rest, AWS Backup recovery points are vulnerable to unauthorized access, which could compromise the confidentiality and integrity of the backed-up data."
aws,/Users/apple/Desktop/github/prowler/providers/aws/services/backup/backup_reportplans_exist/backup_reportplans_exist.metadata.json,,https://docs.aws.amazon.com/aws-backup/latest/devguide/create-report-plan-console.html,backup,This check ensures that there is at least one backup report plan in place.,[],,Ensure that there is at least one AWS Backup report plan,,[],,"['Recover', 'Resilience', 'Backup']",backup_reportplans_exist,"{'Code': {'CLI': 'aws backup create-report-plan --report-plan-name <report-plan-name> --report-delivery-channel <value> --report-setting <value>', 'NativeIaC': '', 'Other': '', 'Terraform': ''}, 'Recommendation': {'Text': 'Use AWS Backup to create backup report plans that provide visibility into the success or failure of backup operations.', 'Url': 'https://docs.aws.amazon.com/aws-backup/latest/devguide/create-report-plan-console.html'}}",low,[],arn:partition:service:region:account-id:backup-report-plan:backup-report-plan-id,AwsBackupBackupPlan,"Without a backup report plan, an organization may lack visibility into the success or failure of backup operations."
aws,/Users/apple/Desktop/github/prowler/providers/aws/services/backup/backup_vaults_exist/backup_vaults_exist.metadata.json,,https://docs.aws.amazon.com/aws-backup/latest/devguide/vaults.html,backup,This check ensures that AWS Backup vaults exist to provide a secure and durable storage location for backup data.,[],,Ensure AWS Backup vaults exist,,[],,"['Recover', 'Resilience', 'Backup']",backup_vaults_exist,"{'Code': {'CLI': 'aws backup create-backup-vault --backup-vault-name <backup_vault_name>', 'NativeIaC': '', 'Other': '', 'Terraform': ''}, 'Recommendation': {'Text': 'Use AWS Backup to create backup vaults for your critical data and services.', 'Url': 'https://docs.aws.amazon.com/aws-backup/latest/devguide/vaults.html'}}",low,[],arn:partition:service:region:account-id:backup-vault:backup-vault-id,AwsBackupBackupVault,"Without an AWS Backup vault, an organization's critical data may be at risk of being lost in the event of an accidental deletion, system failures, or natural disasters."
aws,/Users/apple/Desktop/github/prowler/providers/aws/services/backup/backup_vaults_encrypted/backup_vaults_encrypted.metadata.json,,https://docs.aws.amazon.com/aws-backup/latest/devguide/encryption.html,backup,This check ensures that AWS Backup vaults are encrypted with AWS KMS.,[],,Ensure that AWS Backup vaults are encrypted with AWS KMS,,[],,['Software and Configuration Checks/AWS Security Best Practices'],backup_vaults_encrypted,"{'Code': {'CLI': 'aws backup update-backup-vault --backup-vault-name <backup_vault_name> --encryption-key-arn <kms_key_arn>', 'NativeIaC': '', 'Other': 'https://www.trendmicro.com/cloudoneconformity/knowledge-base/aws/Athena/encrypted-with-cmk.html', 'Terraform': ''}, 'Recommendation': {'Text': 'Use AWS KMS to encrypt your AWS Backup vaults and backup data.', 'Url': 'https://docs.aws.amazon.com/aws-backup/latest/devguide/encryption.html'}}",medium,[],arn:partition:service:region:account-id:backup-vault:backup-vault-id,AwsBackupBackupVault,"Without encryption using AWS KMS, an organization's backup data may be at risk of unauthorized access, which can lead to data breaches and other security incidents."
aws,/Users/apple/Desktop/github/prowler/providers/aws/services/backup/backup_plans_exist/backup_plans_exist.metadata.json,,https://docs.aws.amazon.com/aws-backup/latest/devguide/about-backup-plans.html,backup,This check ensures that there is at least one backup plan in place.,[],,Ensure that there is at least one AWS Backup plan,,[],,"['Recover', 'Resilience', 'Backup']",backup_plans_exist,"{'Code': {'CLI': 'aws backup create-backup-plan --backup-plan <backup_plan_name> --backup-plan-rule <backup_rule_name>', 'NativeIaC': '', 'Other': '', 'Terraform': ''}, 'Recommendation': {'Text': 'Use AWS Backup to create backup plans for your critical data and services.', 'Url': 'https://docs.aws.amazon.com/aws-backup/latest/devguide/about-backup-plans.html'}}",low,[],arn:partition:service:region:account-id:backup-plan:backup-plan-id,AwsBackupBackupPlan,"Without a backup plan, an organization may be at risk of losing important data due to accidental deletion, system failures, or natural disasters. This can result in significant financial and reputational damage for the organization."
aws,/Users/apple/Desktop/github/prowler/providers/aws/services/cloudformation/cloudformation_stack_outputs_find_secrets/cloudformation_stack_outputs_find_secrets.metadata.json,,https://docs.aws.amazon.com/AWSCloudFormation/latest/UserGuide/outputs-section-structure.html,cloudformation,Find secrets in CloudFormation outputs,['secrets'],Infrastructure Protection,Find secrets in CloudFormation outputs,,[],,[],cloudformation_stack_outputs_find_secrets,"{'Code': {'CLI': '', 'NativeIaC': '', 'Other': 'https://docs.prowler.com/checks/aws/secrets-policies/bc_aws_secrets_2', 'Terraform': ''}, 'Recommendation': {'Text': 'Implement automated detective control to scan accounts for passwords and secrets. Use secrets manager service to store and retrieve passwords and secrets.', 'Url': 'https://docs.aws.amazon.com/AWSCloudFormation/latest/UserGuide/aws-properties-secretsmanager-secret-generatesecretstring.html'}}",critical,[],arn:partition:cloudformation:region:account-id:stack/resource-id,AwsCloudFormationStack,Secrets hardcoded into CloudFormation outputs can be used by malware and bad actors to gain lateral access to other services.
aws,/Users/apple/Desktop/github/prowler/providers/aws/services/cloudformation/cloudformation_stacks_termination_protection_enabled/cloudformation_stacks_termination_protection_enabled.metadata.json,,https://docs.aws.amazon.com/AWSCloudFormation/latest/UserGuide/using-cfn-protect-stacks.html,cloudformation,Enable termination protection for Cloudformation Stacks,[],Infrastructure Protection,Enable termination protection for Cloudformation Stacks,,[],,[],cloudformation_stacks_termination_protection_enabled,"{'Code': {'CLI': 'aws cloudformation update-termination-protection --region <REGION_NAME> --stack-name <STACK_NAME> --enable-termination-protection', 'NativeIaC': '', 'Other': '', 'Terraform': ''}, 'Recommendation': {'Text': 'Ensure termination protection is enabled for the cloudformation stacks.', 'Url': 'https://docs.aws.amazon.com/AWSCloudFormation/latest/UserGuide/using-cfn-protect-stacks.html'}}",medium,[],arn:partition:cloudformation:region:account-id:stack/resource-id,AwsCloudFormationStack,"Without termination protection enabled, a critical cloudformation stack can be accidently deleted."
aws,/Users/apple/Desktop/github/prowler/providers/aws/services/cloudformation/cloudformation_stack_cdktoolkit_bootstrap_version/cloudformation_stack_cdktoolkit_bootstrap_version.metadata.json,,https://docs.aws.amazon.com/cdk/latest/guide/bootstrapping.html,cloudformation,Ensure that CDKToolkit stacks have a Bootstrap version of 21 or higher to mitigate security risks.,[],,Ensure that CDKToolkit stacks have a Bootstrap version of 21 or higher to mitigate security risks.,,[],,[],cloudformation_stack_cdktoolkit_bootstrap_version,"{'Code': {'CLI': '', 'NativeIaC': '', 'Other': '', 'Terraform': ''}, 'Recommendation': {'Text': 'Update the CDKToolkit stack Bootstrap version to 21 or later by running the cdk bootstrap command with the latest CDK version.', 'Url': 'https://docs.aws.amazon.com/cdk/latest/guide/bootstrapping.html'}}",high,[],arn:partition:cloudformation:region:account-id:stack/resource-id,AwsCloudFormationStack,Using outdated CDKToolkit Bootstrap versions can expose accounts to risks such as bucket takeover or privilege escalation.
aws,/Users/apple/Desktop/github/prowler/providers/aws/services/elasticache/elasticache_redis_cluster_automatic_failover_enabled/elasticache_redis_cluster_automatic_failover_enabled.metadata.json,,https://docs.aws.amazon.com/AmazonElastiCache/latest/red-ug/AutoFailover.html,elasticache,Ensure Elasticache Redis OSS cache clusters use automatic failover.,['redundancy'],,Ensure Elasticache Redis clusters have automatic failover enabled.,,[],,[],elasticache_redis_cluster_automatic_failover_enabled,"{'Code': {'CLI': '', 'NativeIaC': '', 'Other': 'https://docs.aws.amazon.com/securityhub/latest/userguide/elasticache-controls.html#elasticache-3', 'Terraform': 'https://docs.prowler.com/checks/aws/general-policies/ensure-aws-elasticache-redis-cluster-with-multi-az-automatic-failover-feature-set-to-enabled/'}, 'Recommendation': {'Text': 'Enable automatic failover for ElastiCache (Redis OSS) clusters to ensure high availability and minimize downtime during failures.', 'Url': 'https://redis.io/blog/highly-available-in-memory-cloud-datastores/'}}",medium,[],arn:partition:service:region:account-id:resource-id,Other,"If automatic failover is not enabled, a failure in the primary node could result in significant downtime, impacting the availability and resilience of your application."
aws,/Users/apple/Desktop/github/prowler/providers/aws/services/elasticache/elasticache_cluster_uses_public_subnet/elasticache_cluster_uses_public_subnet.metadata.json,,https://docs.aws.amazon.com/AmazonElastiCache/latest/red-ug/VPCs.html,elasticache,Ensure Elasticache Cluster is not using a public subnet,['internet-exposed'],,Ensure Elasticache Cluster is not using a public subnet,,[],,[],elasticache_cluster_uses_public_subnet,"{'Code': {'CLI': 'aws elasticache modify-cache-cluster --cache-cluster-id my-elasticache-cluster --cache-subnet-group-name my-private-subnet-group', 'NativeIaC': '', 'Other': '', 'Terraform': ''}, 'Recommendation': {'Text': 'To ensure your Elasticache cluster is not using a public subnet, follow the recommended remediation steps based on your preferred method.', 'Url': 'https://docs.aws.amazon.com/AmazonElastiCache/latest/red-ug/VPCs.html'}}",medium,[],arn:partition:service:region:account-id:resource-id,Other,There is a risk of exposing sensitive data if Elasticache Cluster uses a public subnet.
aws,/Users/apple/Desktop/github/prowler/providers/aws/services/elasticache/elasticache_redis_cluster_backup_enabled/elasticache_redis_cluster_backup_enabled.metadata.json,,https://docs.aws.amazon.com/securityhub/latest/userguide/elasticache-controls.html#elasticache-1,elasticache,Ensure Elasticache Redis cache cluster has automatic backups enabled.,[],,Ensure Elasticache Redis cache cluster has automatic backups enabled.,,[],,[],elasticache_redis_cluster_backup_enabled,"{'Code': {'CLI': 'aws elasticache modify-replication-group --region <value> --replication-group-id <value> --snapshot-retention-limit <value> --apply-immediately', 'NativeIaC': '', 'Other': '', 'Terraform': 'https://docs.prowler.com/checks/aws/general-policies/ensure-that-amazon-elasticache-redis-clusters-have-automatic-backup-turned-on/'}, 'Recommendation': {'Text': 'Ensure Elasticache Cluster has automatic backups enabled.', 'Url': 'https://docs.aws.amazon.com/securityhub/latest/userguide/elasticache-controls.html#elasticache-1'}}",high,[],arn:partition:service:region:account-id:resource-id,Other,Ensure that your Amazon ElastiCache Redis cache clusters have a sufficient backup retention period set in order to fulfill your organization's compliance requirements. The retention period represents the number of days for which Amazon ElastiCache service retains automatic Redis cluster backups before deleting them.
aws,/Users/apple/Desktop/github/prowler/providers/aws/services/elasticache/elasticache_redis_cluster_multi_az_enabled/elasticache_redis_cluster_multi_az_enabled.metadata.json,,https://www.trendmicro.com/cloudoneconformity-staging/knowledge-base/aws/ElastiCache/elasticache-multi-az.html#,elasticache,Ensure Elasticache Redis cache cluster has Multi-AZ enabled.,['redundancy'],,Ensure Elasticache Redis cache cluster has Multi-AZ enabled.,,[],,[],elasticache_redis_cluster_multi_az_enabled,"{'Code': {'CLI': 'aws elasticache modify-replication-group --region <value> --replication-group-id <value> --multi-az-enabled --apply-immediately', 'NativeIaC': 'https://www.trendmicro.com/cloudoneconformity-staging/knowledge-base/aws/ElastiCache/elasticache-multi-az.html#', 'Other': '', 'Terraform': 'https://docs.prowler.com/checks/aws/general-policies/ensure-aws-elasticache-redis-cluster-with-multi-az-automatic-failover-feature-set-to-enabled/'}, 'Recommendation': {'Text': 'Ensure Elasticache Redis cache cluster has Multi-AZ enabled.', 'Url': 'https://www.trendmicro.com/cloudoneconformity-staging/knowledge-base/aws/ElastiCache/elasticache-multi-az.html#'}}",medium,[],arn:partition:service:region:account-id:resource-id,AWSElastiCacheClusters,Ensure that your Amazon ElastiCache Redis cache clusters has Multi-AZ enabled.
aws,/Users/apple/Desktop/github/prowler/providers/aws/services/elasticache/elasticache_redis_cluster_in_transit_encryption_enabled/elasticache_redis_cluster_in_transit_encryption_enabled.metadata.json,,https://docs.aws.amazon.com/securityhub/latest/userguide/elasticache-controls.html#elasticache-5,elasticache,Ensure Elasticache Redis cache clusters have in transit encryption enabled.,['encryption'],,Ensure Elasticache Redis cache clusters have in transit encryption enabled.,,[],,[],elasticache_redis_cluster_in_transit_encryption_enabled,"{'Code': {'CLI': '', 'NativeIaC': 'https://docs.prowler.com/checks/aws/general-policies/general_10#cloudformation', 'Other': 'https://docs.prowler.com/checks/aws/general-policies/general_10/', 'Terraform': 'https://docs.prowler.com/checks/aws/general-policies/general_10#terraform'}, 'Recommendation': {'Text': 'Ensure your Elasticache Redis cache clusters have in transit encryption enabled.', 'Url': 'https://docs.aws.amazon.com/AmazonElastiCache/latest/red-ug/in-transit-encryption.html'}}",medium,[],arn:partition:service:region:account-id:resource-id,Other,There is a risk of exposing sensitive data if Elasticache Redis cache cluster does not have in transit encryption enabled.
aws,/Users/apple/Desktop/github/prowler/providers/aws/services/elasticache/elasticache_redis_cluster_rest_encryption_enabled/elasticache_redis_cluster_rest_encryption_enabled.metadata.json,,https://docs.aws.amazon.com/securityhub/latest/userguide/elasticache-controls.html#elasticache-4,elasticache,Ensure Elasticache Redis cache clusters have at rest encryption enabled.,['encryption'],,Ensure Elasticache Redis cache clusters have at rest encryption enabled.,,[],,[],elasticache_redis_cluster_rest_encryption_enabled,"{'Code': {'CLI': '', 'NativeIaC': 'https://docs.prowler.com/checks/aws/general-policies/general_9#cloudformation', 'Other': 'https://docs.prowler.com/checks/aws/general-policies/general_9/', 'Terraform': 'https://docs.prowler.com/checks/aws/general-policies/general_9#terraform'}, 'Recommendation': {'Text': 'Ensure your Elasticache Redis cache clusters have at rest encryption enabled.', 'Url': 'https://docs.aws.amazon.com/AmazonElastiCache/latest/red-ug/at-rest-encryption.html#at-rest-encryption-enable'}}",medium,[],arn:partition:service:region:account-id:resource-id,Other,There is a risk of exposing sensitive data if Elasticache Redis cache clusters does not have at rest encryption enabled.
aws,/Users/apple/Desktop/github/prowler/providers/aws/services/elasticache/elasticache_redis_replication_group_auth_enabled/elasticache_redis_replication_group_auth_enabled.metadata.json,,https://docs.aws.amazon.com/AmazonElastiCache/latest/red-ug/auth.html,elasticache,Ensure Elasticache Redis replication groups of earlier versions use Redis OSS AUTH.,[],,Ensure Elasticache Elasticache Redis replication groups of earlier versions should have Redis OSS AUTH enabled.,,[],,['Software and Configuration Checks/Industry and Regulatory Standards/NIST 800-53 Controls'],elasticache_redis_replication_group_auth_enabled,"{'Code': {'CLI': '', 'NativeIaC': '', 'Other': 'https://docs.aws.amazon.com/securityhub/latest/userguide/elasticache-controls.html#elasticache-6', 'Terraform': ''}, 'Recommendation': {'Text': 'Enable Redis AUTH to require authentication before accessing your Redis instance, and for Redis 6.0 and later, consider implementing Role-Based Access Control (RBAC) for enhanced security.', 'Url': 'https://docs.aws.amazon.com/AmazonElastiCache/latest/red-ug/auth.html#auth-modifyng-token'}}",medium,[],arn:partition:service:region:account-id:resource-id,Other,"Without Redis AUTH enabled, your ElastiCache (Redis) instance is vulnerable to unauthorized access and potential data breaches."
aws,/Users/apple/Desktop/github/prowler/providers/aws/services/elasticache/elasticache_redis_cluster_auto_minor_version_upgrades/elasticache_redis_cluster_auto_minor_version_upgrades.metadata.json,,https://docs.aws.amazon.com/AmazonElastiCache/latest/red-ug/VersionManagement.html,elasticache,Ensure Elasticache Redis cache clusters have automatic minor upgrades enabled.,[],,Ensure Elasticache Redis cache clusters have automatic minor upgrades enabled.,,[],,[],elasticache_redis_cluster_auto_minor_version_upgrades,"{'Code': {'CLI': 'aws elasticache modify-cache-cluster --cache-cluster-id <cluster_id> --apply-immediately --auto-minor-version-upgrade', 'NativeIaC': '', 'Other': 'https://docs.aws.amazon.com/securityhub/latest/userguide/elasticache-controls.html#elasticache-2', 'Terraform': ''}, 'Recommendation': {'Text': 'Ensure Elasticache clusters have automatic minor upgrades enabled.', 'Url': 'https://docs.aws.amazon.com/AmazonElastiCache/latest/red-ug/Clusters.html#Modify'}}",high,[],arn:partition:service:region:account-id:resource-id,Other,"Not enabling automatic minor version upgrades can expose your Redis cluster to security vulnerabilities, performance issues, and increased operational overhead due to the need for manual updates."
