Provider,FilePath,Tags,RelatedUrl,ServiceName,Description,Categories,Notes,CheckTitle,CheckAliases,DependsOn,SubServiceName,CheckType,CheckID,Remediation,Severity,RelatedTo,ResourceIdTemplate,ResourceType,Risk
aws,/Users/apple/Desktop/github/prowler/providers/aws/services/codebuild/codebuild_project_no_secrets_in_variables/codebuild_project_no_secrets_in_variables.metadata.json,,https://docs.aws.amazon.com/codebuild/latest/userguide/how-to-create-project-console.html,codebuild,This check ensures that AWS CodeBuild projects do not contain secrets in environment variables.,[],,Ensure CodeBuild projects do not contain secrets on plaintext environment variables,,[],,['Security Best Practices'],codebuild_project_no_secrets_in_variables,"{'Code': {'CLI': '', 'NativeIaC': '', 'Other': 'https://docs.aws.amazon.com/securityhub/latest/userguide/codebuild-controls.html#codebuild-2', 'Terraform': ''}, 'Recommendation': {'Text': 'Do not store secrets in plaintext environment variables. Use AWS Secrets Manager or AWS Systems Manager Parameter Store to securely store and retrieve sensitive information.', 'Url': 'https://docs.aws.amazon.com/codebuild/latest/userguide/change-project.html'}}",critical,[],arn:partition:service:region:account-id:resource-id,AwsCodeBuildProject,"Using plaintext AWS credentials in CodeBuild project environment variables can expose these sensitive keys, leading to unauthorized access and potential security breaches."
aws,/Users/apple/Desktop/github/prowler/providers/aws/services/codebuild/codebuild_project_user_controlled_buildspec/codebuild_project_user_controlled_buildspec.metadata.json,,,codebuild,Ensure CodeBuild Project uses a controlled buildspec,[],,Ensure CodeBuild Project uses a controlled buildspec,,[],,"['Software and Configuration Checks', 'Industry and Regulatory Standards']",codebuild_project_user_controlled_buildspec,"{'Code': {'CLI': '', 'NativeIaC': '', 'Other': '', 'Terraform': ''}, 'Recommendation': {'Text': 'Use buildspec.yml from a trusted source which user cant interfere with', 'Url': 'https://docs.aws.amazon.com/codebuild/latest/userguide/security.html'}}",medium,[],arn:partition:service:region:account-id:resource-id,AwsCodeBuildProject,The CodeBuild projects with user controlled buildspec
aws,/Users/apple/Desktop/github/prowler/providers/aws/services/codebuild/codebuild_report_group_export_encrypted/codebuild_report_group_export_encrypted.metadata.json,,https://docs.aws.amazon.com/codebuild/latest/userguide/report-group-export-settings.html,codebuild,Ensure that CodeBuild report group exports are encrypted at rest.,['encryption'],,CodeBuild report group exports are encrypted at rest,,[],,[],codebuild_report_group_export_encrypted,"{'Code': {'CLI': 'aws codebuild update-report-group --arn <report-group-arn> --export-config ""exportConfigType=S3, s3Destination={bucket=, encryptionDisabled=true}""', 'NativeIaC': '', 'Other': 'https://docs.aws.amazon.com/securityhub/latest/userguide/codebuild-controls.html#codebuild-7', 'Terraform': ''}, 'Recommendation': {'Text': 'Configure CodeBuild report group exports to use encryption at rest. This can be done by specifying a KMS key ID when creating or updating the report group.', 'Url': 'https://docs.aws.amazon.com/codebuild/latest/userguide/report-group-export-settings.html'}}",medium,[],arn:partition:service:region:account-id:resource-id,Other,"If CodeBuild report group exports are not encrypted, sensitive data could be exposed to unauthorized access."
aws,/Users/apple/Desktop/github/prowler/providers/aws/services/codebuild/codebuild_project_source_repo_url_no_sensitive_credentials/codebuild_project_source_repo_url_no_sensitive_credentials.metadata.json,,https://docs.aws.amazon.com/config/latest/developerguide/codebuild-project-source-repo-url-check.html,codebuild,This check ensures an AWS CodeBuild project source repository URL doesn't contain personal access tokens or a user name and password. The check fails if the source repository URL contains personal access tokens or a user name and password.,[],,Ensure CodeBuild project source repository URLs do not contain sensitive credentials,,[],,['Security Best Practices'],codebuild_project_source_repo_url_no_sensitive_credentials,"{'Code': {'CLI': '', 'NativeIaC': '', 'Other': 'https://docs.aws.amazon.com/securityhub/latest/userguide/codebuild-controls.html#codebuild-1', 'Terraform': ''}, 'Recommendation': {'Text': 'Update your CodeBuild project to use OAuth instead of personal access tokens or basic authentication in your repository URLs.', 'Url': 'https://docs.aws.amazon.com/codebuild/latest/userguide/use-case-based-samples.html'}}",critical,[],arn:partition:service:region:account-id:resource-id,AwsCodeBuildProject,"Storing or transmitting sign-in credentials in clear text or including them in the source repository URL can lead to unintended data exposure or unauthorized access, potentially compromising the security of the system."
aws,/Users/apple/Desktop/github/prowler/providers/aws/services/codebuild/codebuild_project_s3_logs_encrypted/codebuild_project_s3_logs_encrypted.metadata.json,,https://docs.aws.amazon.com/codebuild/latest/userguide/change-project.html#change-project-console-logs,codebuild,Ensure that the S3 logs for CodeBuild projects are encrypted at rest.,"['encryption', 'logging']",,Ensure S3 Logs for CodeBuild Projects are encrypted at rest.,,[],,['Effects/Data Exposure'],codebuild_project_s3_logs_encrypted,"{'Code': {'CLI': 'aws codebuild update-project --name <project-name> --logs-config ""s3Logs={status=ENABLED, location=<bucket-name>/<path>, encryptionDisabled=false""}', 'NativeIaC': '', 'Other': 'https://docs.aws.amazon.com/securityhub/latest/userguide/codebuild-controls.html#codebuild-3', 'Terraform': ''}, 'Recommendation': {'Text': ""Ensure that the CodeBuild project's S3 logs are encrypted at rest by setting the `encryptionDisabled` parameter to `false` in the `s3Logs` configuration."", 'Url': 'https://docs.aws.amazon.com/codebuild/latest/userguide/change-project.html#change-project-console-logs'}}",low,[],arn:partition:service:region:account-id:resource-id,AwsCodeBuildProject,"If the logs are not encrypted, sensitive information could be exposed to unauthorized users."
aws,/Users/apple/Desktop/github/prowler/providers/aws/services/codebuild/codebuild_project_older_90_days/codebuild_project_older_90_days.metadata.json,,,codebuild,Ensure CodeBuild Project has been invoked in the last 90 days,[],,Ensure CodeBuild Project has been invoked in the last 90 days,,[],,"['Software and Configuration Checks', 'Industry and Regulatory Standards']",codebuild_project_older_90_days,"{'Code': {'CLI': '', 'NativeIaC': '', 'Other': '', 'Terraform': ''}, 'Recommendation': {'Text': 'Check if CodeBuild project are really in use and remove the stale ones', 'Url': 'https://docs.aws.amazon.com/codebuild/latest/userguide/delete-project.html'}}",medium,[],arn:partition:service:region:account-id:resource-id,AwsCodeBuildProject,Older CodeBuild projects can be checked to see if they are currently in use.
aws,/Users/apple/Desktop/github/prowler/providers/aws/services/codebuild/codebuild_project_logging_enabled/codebuild_project_logging_enabled.metadata.json,,https://docs.aws.amazon.com/codebuild/latest/userguide/change-project.html#change-project-console-logs,codebuild,Ensure that CodeBuild projects have S3 or CloudWatch logging enabled.,['logging'],,Ensure that CodeBuild projects have S3 or CloudWatch logging enabled,,[],,[],codebuild_project_logging_enabled,"{'Code': {'CLI': 'aws codebuild update-project --name <project-name> --logs-config ""cloudWatchLogs={status=ENABLED},s3Logs={status=ENABLED""}', 'NativeIaC': '', 'Other': 'https://docs.aws.amazon.com/securityhub/latest/userguide/codebuild-controls.html#codebuild-4', 'Terraform': ''}, 'Recommendation': {'Text': 'Enable logging for CodeBuild projects to capture build events and logs for future analysis and incident response.', 'Url': 'https://docs.aws.amazon.com/codebuild/latest/userguide/change-project.html#change-project-console-logs'}}",medium,[],arn:partition:service:region:account-id:resource-id,AwsCodeBuildProject,"Without logging, tracking and investigating security incidents in CodeBuild projects becomes challenging, reducing confidence in threat detections."
aws,/Users/apple/Desktop/github/prowler/providers/aws/services/kinesis/kinesis_stream_data_retention_period/kinesis_stream_data_retention_period.metadata.json,,https://docs.aws.amazon.com/config/latest/developerguide/kinesis-stream-backup-retention-check.html,kinesis,Ensure Kinesis streams have an adequate data retention period.,[],,Kinesis streams should have an adequate data retention period.,,[],,['Software and Configuration Checks/Industry and Regulatory Standards/AWS Foundational Security Best Practices'],kinesis_stream_data_retention_period,"{'Code': {'CLI': 'aws kinesis increase-stream-retention-period --stream-name <stream-name> --retention-period-hours <hours>', 'NativeIaC': '', 'Other': 'https://docs.aws.amazon.com/securityhub/latest/userguide/kinesis-controls.html#kinesis-3', 'Terraform': ''}, 'Recommendation': {'Text': 'Configure an adequate data retention period for Kinesis streams to ensure data is available for the required timeframe. Set the retention period based on your application’s data retention requirements, and consider at least 168 hours (or customize as necessary).', 'Url': 'https://docs.aws.amazon.com/streams/latest/dev/kinesis-extended-retention.html'}}",medium,[],arn:partition:kinesis::account-id:stream/stream-name,AwsKinesisStream,"An inadequate data retention period may result in data records being deleted before they can be processed or backed up, increasing the risk of data loss. This is especially critical for applications that rely on historical data availability for analysis, monitoring, and recovery in case of failures."
aws,/Users/apple/Desktop/github/prowler/providers/aws/services/kinesis/kinesis_stream_encrypted_at_rest/kinesis_stream_encrypted_at_rest.metadata.json,,https://docs.aws.amazon.com/AmazonS3/latest/userguide/UsingKMSEncryption.html,kinesis,Ensure Kinesis streams use server-side encryption with AWS KMS keys for data protection.,[],,Kinesis streams should be encrypted at rest.,,[],,['Software and Configuration Checks/Industry and Regulatory Standards/NIST 800-53 Controls'],kinesis_stream_encrypted_at_rest,"{'Code': {'CLI': 'aws kinesis start-stream-encryption --stream-name <your-stream-name> --encryption-type KMS --key-id <your-kms-key-id>', 'NativeIaC': 'https://docs.prowler.com/checks/aws/general-policies/bc_aws_general_22/#cloudformation', 'Other': 'https://docs.aws.amazon.com/securityhub/latest/userguide/kinesis-controls.html#kinesis-1', 'Terraform': 'https://docs.prowler.com/checks/aws/general-policies/bc_aws_general_22/#terraform'}, 'Recommendation': {'Text': 'Enable server-side encryption for Kinesis streams using AWS KMS keys to ensure that all data is encrypted before it is stored, protecting data at rest and reducing the risk of unauthorized access.', 'Url': 'https://docs.aws.amazon.com/streams/latest/dev/getting-started-with-sse.html'}}",medium,[],arn:partition:kinesis::account-id:stream/stream-name,AwsKinesisStream,"If Kinesis streams are not encrypted at rest, sensitive data stored in the stream could be exposed to unauthorized access or breaches. This could lead to potential data theft or misuse of unencrypted data."
aws,/Users/apple/Desktop/github/prowler/providers/aws/services/organizations/organizations_opt_out_ai_services_policy/organizations_opt_out_ai_services_policy.metadata.json,,https://docs.aws.amazon.com/organizations/latest/userguide/orgs_manage_policies_ai-opt-out_all.html,organizations,This control checks whether the AWS Organizations opt-out of AI services policy is enabled and whether child-accounts are disallowed to overwrite this policy. The control fails if the policy is not enabled or if child-accounts are not disallowed to overwrite this policy.,[],,Ensure that AWS Organizations opt-out of AI services policy is enabled and disallow child-accounts to overwrite this policy.,,[],,[],organizations_opt_out_ai_services_policy,"{'Code': {'CLI': '', 'NativeIaC': '', 'Other': '', 'Terraform': ''}, 'Recommendation': {'Text': 'Artificial Intelligence (AI) services opt-out policies enable you to control whether AWS AI services can store and use your content. Enable the AWS Organizations opt-out of AI services policy and disallow child-accounts to overwrite this policy.', 'Url': 'https://docs.aws.amazon.com/organizations/latest/userguide/disable-policy-type.html'}}",low,[],arn:partition:service::account-id:organization/organization-id,Other,"By default, AWS may be using your data to train its AI models. This may include data from your AWS CloudTrail logs, AWS Config rules, and AWS GuardDuty findings. If you opt out of AI services, AWS will not use your data to train its AI models."
aws,/Users/apple/Desktop/github/prowler/providers/aws/services/organizations/organizations_scp_check_deny_regions/organizations_scp_check_deny_regions.metadata.json,,,organizations,"As best practice, AWS Regions should be restricted and only allow the ones that are needed.",[],,Check if AWS Regions are restricted with SCP policies,,[],,['Logging and Monitoring'],organizations_scp_check_deny_regions,"{'Code': {'CLI': '', 'NativeIaC': '', 'Other': '', 'Terraform': ''}, 'Recommendation': {'Text': 'Restrict AWS Regions using SCP policies.', 'Url': 'https://docs.aws.amazon.com/organizations/latest/userguide/orgs_manage_policies_scps_examples_general.html#example-scp-deny-region'}}",low,[],arn:partition:service::account-id:organization/organization-id,Other,"The risk associated with not restricting AWS Regions with Service Control Policies (SCPs) is that it can lead to unauthorized access or use of resources in regions that are not intended for use. This can result in increased costs due to inefficiencies in resource usage and can also expose sensitive data to unauthorized access or breaches. By restricting access to AWS Regions with SCP policies, organizations can help ensure that only authorized personnel have access to the resources they need, while minimizing the risk of security breaches and compliance violations."
aws,/Users/apple/Desktop/github/prowler/providers/aws/services/organizations/organizations_tags_policies_enabled_and_attached/organizations_tags_policies_enabled_and_attached.metadata.json,,,organizations,Check if an AWS Organization has tags policies enabled and attached.,[],,Check if an AWS Organization has tags policies enabled and attached.,,[],,[],organizations_tags_policies_enabled_and_attached,"{'Code': {'CLI': '', 'NativeIaC': '', 'Other': '', 'Terraform': ''}, 'Recommendation': {'Text': 'Enable and attach AWS Organizations tags policies.', 'Url': 'https://docs.aws.amazon.com/organizations/latest/userguide/orgs_manage_policies_tag-policies.html'}}",medium,[],arn:partition:service::account-id:organization/organization-id,Other,"If an AWS Organization tags policies are not enabled and attached, it is not possible to enforce tags on AWS resources."
aws,/Users/apple/Desktop/github/prowler/providers/aws/services/organizations/organizations_delegated_administrators/organizations_delegated_administrators.metadata.json,,,organizations,This check verify if there are AWS Organizations delegated administrators and if they are trusted (you can define your trusted delegated administrator in Prowler configuration),[],,Check if AWS Organizations delegated administrators are trusted,,[],,['Logging and Monitoring'],organizations_delegated_administrators,"{'Code': {'CLI': '', 'NativeIaC': '', 'Other': '', 'Terraform': ''}, 'Recommendation': {'Text': 'Review delegated administrators', 'Url': 'https://docs.aws.amazon.com/organizations/latest/userguide/orgs_delegate_policies.html'}}",high,[],arn:partition:service::account-id:organization/organization-id,Other,"The risk associated with having untrusted delegated administrators within an AWS Organizations is that they may have the ability to access and make changes to sensitive data and resources within an organization's AWS accounts. This can result in unauthorized access or data breaches, which can lead to financial losses, damage to reputation, and legal liabilities. It's important to carefully vet and monitor AWS Organizations delegated administrators to ensure that they are trustworthy and have a legitimate need for access to the organization's resources."
aws,/Users/apple/Desktop/github/prowler/providers/aws/services/organizations/organizations_account_part_of_organizations/organizations_account_part_of_organizations.metadata.json,,,organizations,Ensure that AWS Organizations service is currently in use.,[],,Check if account is part of an AWS Organizations,,[],,['Logging and Monitoring'],organizations_account_part_of_organizations,"{'Code': {'CLI': '', 'NativeIaC': '', 'Other': '', 'Terraform': ''}, 'Recommendation': {'Text': 'Create or Join an AWS Organization', 'Url': 'https://docs.aws.amazon.com/organizations/latest/userguide/orgs_manage_org_create.html'}}",medium,[],arn:partition:service::account-id:organization/organization-id,Other,"The risk associated with not being part of an AWS Organizations is that it can lead to a lack of centralized management and control over the AWS accounts in an organization. This can make it difficult to enforce security policies consistently across all accounts, and can also result in increased costs due to inefficiencies in resource usage. Additionally, not being part of an AWS Organizations can make it harder to track and manage account usage and access."
aws,/Users/apple/Desktop/github/prowler/providers/aws/services/shield/shield_advanced_protection_in_classic_load_balancers/shield_advanced_protection_in_classic_load_balancers.metadata.json,,https://docs.aws.amazon.com/waf/latest/developerguide/configure-new-protection.html,shield,Check if Classic Load Balancers are protected by AWS Shield Advanced.,[],,Check if Classic Load Balancers are protected by AWS Shield Advanced.,,[],,[],shield_advanced_protection_in_classic_load_balancers,"{'Code': {'CLI': '', 'NativeIaC': '', 'Other': '', 'Terraform': ''}, 'Recommendation': {'Text': 'Add as a protected resource in AWS Shield Advanced.', 'Url': 'https://docs.aws.amazon.com/waf/latest/developerguide/configure-new-protection.html'}}",medium,[],,AwsElbLoadBalancer,AWS Shield Advanced provides expanded DDoS attack protection for your resources.
aws,/Users/apple/Desktop/github/prowler/providers/aws/services/shield/shield_advanced_protection_in_route53_hosted_zones/shield_advanced_protection_in_route53_hosted_zones.metadata.json,,https://docs.aws.amazon.com/waf/latest/developerguide/configure-new-protection.html,shield,Check if Route53 hosted zones are protected by AWS Shield Advanced.,[],,Check if Route53 hosted zones are protected by AWS Shield Advanced.,,[],,[],shield_advanced_protection_in_route53_hosted_zones,"{'Code': {'CLI': '', 'NativeIaC': '', 'Other': '', 'Terraform': ''}, 'Recommendation': {'Text': 'Add as a protected resource in AWS Shield Advanced.', 'Url': 'https://docs.aws.amazon.com/waf/latest/developerguide/configure-new-protection.html'}}",medium,[],,AwsRoute53HostedZone,AWS Shield Advanced provides expanded DDoS attack protection for your resources.
aws,/Users/apple/Desktop/github/prowler/providers/aws/services/shield/shield_advanced_protection_in_cloudfront_distributions/shield_advanced_protection_in_cloudfront_distributions.metadata.json,,https://docs.aws.amazon.com/waf/latest/developerguide/configure-new-protection.html,shield,Check if Cloudfront distributions are protected by AWS Shield Advanced.,[],,Check if Cloudfront distributions are protected by AWS Shield Advanced.,,[],,[],shield_advanced_protection_in_cloudfront_distributions,"{'Code': {'CLI': '', 'NativeIaC': '', 'Other': '', 'Terraform': ''}, 'Recommendation': {'Text': 'Add as a protected resource in AWS Shield Advanced.', 'Url': 'https://docs.aws.amazon.com/waf/latest/developerguide/configure-new-protection.html'}}",medium,[],,AwsCloudFrontDistribution,AWS Shield Advanced provides expanded DDoS attack protection for your resources.
aws,/Users/apple/Desktop/github/prowler/providers/aws/services/shield/shield_advanced_protection_in_global_accelerators/shield_advanced_protection_in_global_accelerators.metadata.json,,https://docs.aws.amazon.com/waf/latest/developerguide/configure-new-protection.html,shield,Check if Global Accelerators are protected by AWS Shield Advanced.,[],,Check if Global Accelerators are protected by AWS Shield Advanced.,,[],,[],shield_advanced_protection_in_global_accelerators,"{'Code': {'CLI': '', 'NativeIaC': '', 'Other': '', 'Terraform': ''}, 'Recommendation': {'Text': 'Add as a protected resource in AWS Shield Advanced.', 'Url': 'https://docs.aws.amazon.com/waf/latest/developerguide/configure-new-protection.html'}}",medium,[],,Other,AWS Shield Advanced provides expanded DDoS attack protection for your resources.
aws,/Users/apple/Desktop/github/prowler/providers/aws/services/shield/shield_advanced_protection_in_associated_elastic_ips/shield_advanced_protection_in_associated_elastic_ips.metadata.json,,https://docs.aws.amazon.com/waf/latest/developerguide/configure-new-protection.html,shield,Check if Elastic IP addresses with associations are protected by AWS Shield Advanced.,[],,Check if Elastic IP addresses with associations are protected by AWS Shield Advanced.,,[],,[],shield_advanced_protection_in_associated_elastic_ips,"{'Code': {'CLI': '', 'NativeIaC': '', 'Other': '', 'Terraform': ''}, 'Recommendation': {'Text': 'Add as a protected resource in AWS Shield Advanced.', 'Url': 'https://docs.aws.amazon.com/waf/latest/developerguide/configure-new-protection.html'}}",medium,[],,AwsEc2Eip,AWS Shield Advanced provides expanded DDoS attack protection for your resources.
aws,/Users/apple/Desktop/github/prowler/providers/aws/services/shield/shield_advanced_protection_in_internet_facing_load_balancers/shield_advanced_protection_in_internet_facing_load_balancers.metadata.json,,https://docs.aws.amazon.com/waf/latest/developerguide/configure-new-protection.html,shield,Check if internet-facing Application Load Balancers are protected by AWS Shield Advanced.,[],,Check if internet-facing Application Load Balancers are protected by AWS Shield Advanced.,,[],,[],shield_advanced_protection_in_internet_facing_load_balancers,"{'Code': {'CLI': '', 'NativeIaC': '', 'Other': '', 'Terraform': ''}, 'Recommendation': {'Text': 'Add as a protected resource in AWS Shield Advanced.', 'Url': 'https://docs.aws.amazon.com/waf/latest/developerguide/configure-new-protection.html'}}",medium,[],,AwsElbv2LoadBalancer,AWS Shield Advanced provides expanded DDoS attack protection for your resources.
aws,/Users/apple/Desktop/github/prowler/providers/aws/services/ssm/ssm_documents_set_as_public/ssm_documents_set_as_public.metadata.json,,https://docs.aws.amazon.com/systems-manager/latest/userguide/ssm-before-you-share.html,ssm,Check if there are SSM Documents set as public.,['internet-exposed'],,Check if there are SSM Documents set as public.,,[],,[],ssm_documents_set_as_public,"{'Code': {'CLI': '', 'NativeIaC': '', 'Other': 'https://github.com/cloudmatos/matos/tree/master/remediations/aws/ssm/ssm-doc-block', 'Terraform': ''}, 'Recommendation': {'Text': 'Carefully review the contents of the document before is shared. Enable SSM Block public sharing for documents.', 'Url': 'https://docs.aws.amazon.com/systems-manager/latest/userguide/ssm-before-you-share.html'}}",high,[],arn:aws:ssm:region:account-id:document/document-name,AwsSsmDocument,SSM Documents may contain private information or even secrets and tokens.
aws,/Users/apple/Desktop/github/prowler/providers/aws/services/ssm/ssm_document_secrets/ssm_document_secrets.metadata.json,,https://docs.aws.amazon.com/AWSCloudFormation/latest/UserGuide/aws-properties-secretsmanager-secret-generatesecretstring.html,ssm,Find secrets in SSM Documents.,['secrets'],,Find secrets in SSM Documents.,,[],,[],ssm_document_secrets,"{'Code': {'CLI': '', 'NativeIaC': '', 'Other': '', 'Terraform': ''}, 'Recommendation': {'Text': 'Implement automated detective control (e.g. using tools like Prowler) to scan accounts for passwords and secrets. Use Secrets Manager service to store and retrieve passwords and secrets.', 'Url': 'https://docs.aws.amazon.com/AWSCloudFormation/latest/UserGuide/aws-properties-secretsmanager-secret-generatesecretstring.html'}}",critical,[],arn:aws:ssm:region:account-id:document/document-name,AwsSsmDocument,Secrets hardcoded into SSM Documents by malware and bad actors to gain lateral access to other services.
