compliance_name,unique_key,id,name,description,check_count,service_count,check_functions_str,services_str,applied_services
cisa_aws,cisa_gen_001_001,your-systems-1,Your Systems-1,Learn what is on your network. Maintain inventories of hardware and software assets to know what is in play and at-risk from attack.,4,2,"['ec2_instance_managed_by_ssm', 'ec2_instance_older_than_specific_days', 'ssm_managed_compliant_patching', 'ec2_elastic_ip_unassigned']","['ssm', 'ec2']","['ec2', 'ssm']"
cisa_aws,cisa_gen_001_002,your-systems-2,Your Systems-2,Leverage automatic updates for all operating systems and third-party software.,3,3,"['rds_instance_minor_version_upgrade_enabled', 'redshift_cluster_automatic_upgrades', 'ssm_managed_compliant_patching']","['ssm', 'redshift', 'rds']","['rds', 'redshift', 'ssm']"
cisa_aws,cisa_gen_001_003,your-systems-3,Your Systems-3,Implement security configurations for all hardware and software assets.,84,23,"['apigateway_restapi_client_certificate_enabled', 'apigateway_restapi_logging_enabled', 'apigateway_restapi_waf_acl_attached', 'cloudtrail_multi_region_enabled', 'cloudtrail_s3_dataevents_read_enabled', 'cloudtrail_s3_dataevents_write_enabled', 'cloudtrail_multi_region_enabled', 'cloudtrail_kms_encryption_enabled', 'cloudtrail_log_file_validation_enabled', 'codebuild_project_user_controlled_buildspec', 'dynamodb_accelerator_cluster_encryption_enabled', 'dynamodb_tables_kms_cmk_encryption_enabled', 'dynamodb_tables_pitr_enabled', 'dynamodb_tables_pitr_enabled', 'ec2_ebs_volume_encryption', 'ec2_ebs_public_snapshot', 'ec2_ebs_default_encryption', 'ec2_instance_public_ip', 'efs_encryption_at_rest_enabled', 'efs_have_backup_enabled', 'elb_logging_enabled', 'elbv2_deletion_protection', 'elbv2_waf_acl_attached', 'elbv2_ssl_listeners', 'elb_ssl_listeners', 'emr_cluster_master_nodes_no_public_ip', 'opensearch_service_domains_encryption_at_rest_enabled', 'opensearch_service_domains_cloudwatch_logging_enabled', 'opensearch_service_domains_node_to_node_encryption_enabled', 'guardduty_is_enabled', 'iam_password_policy_minimum_length_14', 'iam_password_policy_lowercase', 'iam_password_policy_number', 'iam_password_policy_number', 'iam_password_policy_symbol', 'iam_password_policy_uppercase', 'iam_no_custom_policy_permissive_role_assumption', 'iam_aws_attached_policy_no_administrative_privileges', 'iam_customer_attached_policy_no_administrative_privileges', 'iam_inline_policy_no_administrative_privileges', 'iam_root_hardware_mfa_enabled', 'iam_root_mfa_enabled', 'iam_no_root_access_key', 'iam_rotate_access_key_90_days', 'iam_user_mfa_enabled_console_access', 'iam_user_mfa_enabled_console_access', 'iam_user_accesskey_unused', 'iam_user_console_access_unused', 'kms_cmk_rotation_enabled', 'awslambda_function_not_publicly_accessible', 'awslambda_function_not_publicly_accessible', 'cloudwatch_log_group_kms_encryption_enabled', 'cloudwatch_log_group_kms_encryption_enabled', 'rds_instance_enhanced_monitoring_enabled', 'rds_instance_backup_enabled', 'rds_instance_deletion_protection', 'rds_instance_storage_encrypted', 'rds_instance_backup_enabled', 'rds_instance_integration_cloudwatch_logs', 'rds_instance_multi_az', 'rds_instance_no_public_access', 'rds_instance_storage_encrypted', 'rds_snapshots_public_access', 'redshift_cluster_automated_snapshot', 'redshift_cluster_audit_logging', 'redshift_cluster_public_access', 's3_bucket_default_encryption', 's3_bucket_secure_transport_policy', 's3_bucket_server_access_logging_enabled', 's3_bucket_public_access', 's3_bucket_policy_public_write_access', 's3_bucket_object_versioning', 's3_account_level_public_access_blocks', 's3_bucket_public_access', 'sagemaker_training_jobs_volume_and_output_encryption_enabled', 'sagemaker_notebook_instance_without_direct_internet_access_configured', 'sagemaker_notebook_instance_encryption_enabled', 'secretsmanager_automatic_rotation_enabled', 'securityhub_enabled', 'sns_topics_kms_encryption_at_rest_enabled', 'vpc_endpoint_connections_trust_boundaries', 'ec2_securitygroup_default_restrict_traffic', 'ec2_securitygroup_allow_ingress_from_internet_to_tcp_port_22', 'ec2_securitygroup_allow_ingress_from_internet_to_all_ports']","['codebuild', 'opensearch', 'securityhub', 'cloudwatch', 'kms', 'ec2', 'sns', 'elbv2', 'guardduty', 'vpc', 'emr', 'iam', 'redshift', 'awslambda', 'secretsmanager', 'efs', 's3', 'elb', 'rds', 'dynamodb', 'sagemaker', 'apigateway', 'cloudtrail']","['apigateway', 'cloudtrail', 'codebuild', 'dynamodb', 'ec2', 'efs', 'elb', 'elbv2', 'emr', 'guardduty', 'iam', 'kms', 'opensearch', 'rds', 'redshift', 's3', 'sagemaker', 'secretsmanager', 'securityhub', 'sns', 'vpc']"
cisa_aws,cisa_gen_001_001,your-surroundings-1,Your Surroundings-1,"Learn who is on your network. Maintain inventories of network connections (user accounts, vendors, business partners, etc.).",2,2,"['ec2_elastic_ip_unassigned', 'vpc_flow_logs_enabled']","['ec2', 'vpc']",
cisa_aws,cisa_gen_001_002,your-surroundings-2,Your Surroundings-2,"Leverage multi-factor authentication for all users, starting with privileged, administrative and remote access users.",3,1,"['iam_root_hardware_mfa_enabled', 'iam_root_mfa_enabled', 'iam_user_mfa_enabled_console_access']",['iam'],
cisa_aws,cisa_gen_001_003,your-surroundings-3,Your Surroundings-3,Grant access and admin permissions based on need-to-know and least privilege.,6,2,"['elbv2_ssl_listeners', 'iam_no_custom_policy_permissive_role_assumption', 'iam_aws_attached_policy_no_administrative_privileges', 'iam_customer_attached_policy_no_administrative_privileges', 'iam_inline_policy_no_administrative_privileges', 'iam_no_root_access_key']","['elbv2', 'iam']",
cisa_aws,cisa_gen_001_004,your-surroundings-4,Your Surroundings-4,Leverage unique passwords for all user accounts.,6,1,"['iam_password_policy_minimum_length_14', 'iam_password_policy_lowercase', 'iam_password_policy_number', 'iam_password_policy_number', 'iam_password_policy_symbol', 'iam_password_policy_uppercase']",['iam'],
cisa_aws,cisa_gen_001_001,your-data-1,Your Data-1,Learn how your data is protected.,13,10,"['efs_encryption_at_rest_enabled', 'cloudtrail_kms_encryption_enabled', 'dynamodb_tables_kms_cmk_encryption_enabled', 'ec2_ebs_volume_encryption', 'ec2_ebs_default_encryption', 'opensearch_service_domains_encryption_at_rest_enabled', 'rds_instance_storage_encrypted', 'rds_instance_storage_encrypted', 'redshift_cluster_audit_logging', 's3_bucket_default_encryption', 'sagemaker_training_jobs_volume_and_output_encryption_enabled', 'sagemaker_notebook_instance_encryption_enabled', 'sns_topics_kms_encryption_at_rest_enabled']","['opensearch', 'efs', 'sns', 'redshift', 's3', 'dynamodb', 'sagemaker', 'ec2', 'rds', 'cloudtrail']",
cisa_aws,cisa_gen_001_002,your-data-2,Your Data-2,"Learn what is happening on your network, manage network and perimeter components, host and device components, data-at-rest and in-transit, and user behavior activities.",49,18,"['acm_certificates_expiration_check', 'apigateway_restapi_client_certificate_enabled', 'apigateway_restapi_logging_enabled', 'efs_have_backup_enabled', 'cloudtrail_multi_region_enabled', 'cloudtrail_s3_dataevents_read_enabled', 'cloudtrail_s3_dataevents_write_enabled', 'cloudtrail_multi_region_enabled', 'cloudwatch_log_metric_filter_and_alarm_for_cloudtrail_configuration_changes_enabled', 'cloudwatch_log_group_kms_encryption_enabled', 'dynamodb_tables_kms_cmk_encryption_enabled', 'ec2_ebs_volume_encryption', 'ec2_instance_public_ip', 'efs_encryption_at_rest_enabled', 'elb_logging_enabled', 'elbv2_waf_acl_attached', 'elbv2_ssl_listeners', 'elb_ssl_listeners', 'emr_cluster_master_nodes_no_public_ip', 'opensearch_service_domains_encryption_at_rest_enabled', 'opensearch_service_domains_cloudwatch_logging_enabled', 'opensearch_service_domains_node_to_node_encryption_enabled', 'awslambda_function_not_publicly_accessible', 'awslambda_function_not_publicly_accessible', 'cloudwatch_log_group_kms_encryption_enabled', 'rds_instance_storage_encrypted', 'rds_instance_integration_cloudwatch_logs', 'rds_instance_no_public_access', 'rds_snapshots_public_access', 'rds_snapshots_public_access', 'redshift_cluster_audit_logging', 'redshift_cluster_public_access', 's3_bucket_default_encryption', 's3_bucket_secure_transport_policy', 'redshift_cluster_public_access', 's3_bucket_server_access_logging_enabled', 's3_bucket_public_access', 's3_bucket_policy_public_write_access', 's3_account_level_public_access_blocks', 's3_bucket_acl_prohibited', 'sagemaker_training_jobs_volume_and_output_encryption_enabled', 'sagemaker_notebook_instance_without_direct_internet_access_configured', 'sagemaker_notebook_instance_encryption_enabled', 'sns_topics_kms_encryption_at_rest_enabled', 'ec2_securitygroup_default_restrict_traffic', 'vpc_flow_logs_enabled', 'ec2_networkacl_allow_ingress_any_port', 'ec2_securitygroup_allow_ingress_from_internet_to_tcp_port_22', 'ec2_securitygroup_allow_ingress_from_internet_to_all_ports']","['opensearch', 'efs', 'sns', 'elbv2', 'redshift', 'vpc', 'ec2', 's3', 'acm', 'cloudwatch', 'dynamodb', 'elb', 'emr', 'sagemaker', 'awslambda', 'apigateway', 'rds', 'cloudtrail']",
cisa_aws,cisa_gen_001_004,your-data-4,Your Data-4,Establish regular automated backups and redundancies of key systems.,8,6,"['dynamodb_tables_pitr_enabled', 'efs_have_backup_enabled', 'elbv2_deletion_protection', 'rds_instance_backup_enabled', 'rds_instance_deletion_protection', 'rds_instance_backup_enabled', 'redshift_cluster_automated_snapshot', 's3_bucket_object_versioning']","['efs', 'elbv2', 's3', 'dynamodb', 'redshift', 'rds']",
cisa_aws,cisa_gen_001_002,your-crisis-response-2,Your Crisis Response-2,"Lead development of an internal reporting structure to detect, communicate and contain attacks.",2,2,"['guardduty_is_enabled', 'securityhub_enabled']","['guardduty', 'securityhub']",
cisa_aws,cisa_gen_001_001,booting-up-thing-to-do-first-1,YBooting Up: Things to Do First-1,"Lead development of an internal reporting structure to detect, communicate and contain attacks.",7,5,"['dynamodb_tables_pitr_enabled', 'dynamodb_tables_pitr_enabled', 'efs_have_backup_enabled', 'rds_instance_backup_enabled', 'rds_instance_backup_enabled', 'redshift_cluster_automated_snapshot', 's3_bucket_object_versioning']","['efs', 's3', 'dynamodb', 'redshift', 'rds']",
cisa_aws,cisa_gen_001_002,booting-up-thing-to-do-first-2,YBooting Up: Things to Do First-2,"Require multi-factor authentication (MFA) for accessing your systems whenever possible. MFA should be required of all users, but start with privileged, administrative, and remote access users.",4,1,"['iam_user_hardware_mfa_enabled', 'iam_root_mfa_enabled', 'iam_user_mfa_enabled_console_access', 'iam_user_hardware_mfa_enabled']",['iam'],
cisa_aws,cisa_gen_001_003,booting-up-thing-to-do-first-3,YBooting Up: Things to Do First-3,"Enable automatic updates whenever possible. Replace unsupported operating systems, applications and hardware. Test and deploy patches quickly.",3,3,"['rds_instance_minor_version_upgrade_enabled', 'redshift_cluster_automatic_upgrades', 'ssm_managed_compliant_patching']","['ssm', 'redshift', 'rds']",
soc2_aws,,cc_1_3,"CC1.3 COSO Principle 3: Management establishes, with board oversight, structures, reporting lines, and appropriate authorities and responsibilities in the pursuit of objectives","Considers All Structures of the Entity - Management and the board of directors consider the multiple structures used (including operating units, legal entities, geographic distribution, and outsourced service providers) to support the achievement of objectives. Establishes Reporting Lines - Management designs and evaluates lines of reporting for each entity structure to enable execution of authorities and responsibilities and flow of information to manage the activities of the entity. Defines, Assigns, and Limits Authorities and Responsibilities - Management and the board of directors delegate authority, define responsibilities, and use appropriate processes and technology to assign responsibility and segregate duties as necessary at the various levels of the organization. Additional points of focus specifically related to all engagements using the trust services criteria: Addresses Specific Requirements When Defining Authorities and Responsibilities—Management and the board of directors consider requirements relevant to security, availability, processing integrity, confidentiality, and privacy when defining authorities and responsibilities. Considers Interactions With External Parties When Establishing Structures, Reporting Lines, Authorities, and Responsibilities — Management and the board of directors consider the need for the entity to interact with and monitor the activities of external parties when establishing structures, reporting lines, authorities, and responsibilities.",6,1,"['iam_policy_attached_only_to_group_or_roles', 'iam_aws_attached_policy_no_administrative_privileges', 'iam_customer_attached_policy_no_administrative_privileges', 'iam_inline_policy_no_administrative_privileges', 'iam_user_accesskey_unused', 'iam_user_console_access_unused']",['iam'],
soc2_aws,,cc_2_1,"CC2.1 COSO Principle 13: The entity obtains or generates and uses relevant, quality information to support the functioning of internal control","Identifies Information Requirements - A process is in place to identify the information required and expected to support the functioning of the other components of internal control and the achievement of the entity’s objectives. Captures Internal and External Sources of Data - Information systems capture internal and external sources of data. Processes Relevant Data Into Information - Information systems process and transform relevant data into information. Maintains Quality Throughout Processing - Information systems produce information that is timely, current, accurate, complete, accessible, protected, verifiable, and retained. Information is reviewed to assess its relevance in supporting the internal control components.",4,2,"['cloudtrail_s3_dataevents_read_enabled', 'cloudtrail_s3_dataevents_write_enabled', 'cloudtrail_multi_region_enabled', 'config_recorder_all_regions_enabled']","['config', 'cloudtrail']",
soc2_aws,,cc_3_1,CC3.1 COSO Principle 6: The entity specifies objectives with sufficient clarity to enable the identification and assessment of risks relating to objectives,"Operations Objectives: Reflects Management's Choices - Operations objectives reflect management's choices about structure, industry considerations, and performance of the entity. Considers Tolerances for Risk - Management considers the acceptable levels of variation relative to the achievement of operations objectives. External Financial Reporting Objectives: Complies With Applicable Accounting Standards - Financial reporting objectives are consistent with accounting principles suitable and available for that entity. The accounting principles selected are appropriate in the circumstances. External Nonfinancial Reporting Objectives: Complies With Externally Established Frameworks - Management establishes objectives consistent with laws and regulations or standards and frameworks of recognized external organizations. Reflects Entity Activities - External reporting reflects the underlying transactions and events within a range of acceptable limits. Considers the Required Level of Precision—Management reflects the required level of precision and accuracy suitable for user needs and based on criteria established by third parties in nonfinancial reporting. Internal Reporting Objectives: Reflects Management's Choices - Internal reporting provides management with accurate and complete information regarding management's choices and information needed in managing the entity. Considers the Required Level of Precision—Management reflects the required level of precision and accuracy suitable for user needs in nonfinancial reporting objectives and materiality within financial reporting objectives. Reflects Entity Activities—Internal reporting reflects the underlying transactions and events within a range of acceptable limits. Compliance Objectives: Reflects External Laws and Regulations - Laws and regulations establish minimum standards of conduct, which the entity integrates into compliance objectives. Considers Tolerances for Risk - Management considers the acceptable levels of variation relative to the achievement of operations objectives. Additional point of focus specifically related to all engagements using the trust services criteria: Establishes Sub-objectives to Support Objectives—Management identifies sub-objectives related to security, availability, processing integrity, confidentiality, and privacy to support the achievement of the entity’s objectives related to reporting, operations, and compliance.",3,3,"['guardduty_is_enabled', 'securityhub_enabled', 'config_recorder_all_regions_enabled']","['config', 'guardduty', 'securityhub']",
soc2_aws,,cc_3_2,CC3.2 COSO Principle 7: The entity identifies risks to the achievement of its objectives across the entity and analyzes risks as a basis for determining how the risks should be managed,"Includes Entity, Subsidiary, Division, Operating Unit, and Functional Levels - The entity identifies and assesses risk at the entity, subsidiary, division, operating unit, and functional levels relevant to the achievement of objectives. Analyzes Internal and External Factors - Risk identification considers both internal and external factors and their impact on the achievement of objectives. Involves Appropriate Levels of Management - The entity puts into place effective risk assessment mechanisms that involve appropriate levels of management. Estimates Significance of Risks Identified - Identified risks are analyzed through a process that includes estimating the potential significance of the risk. Determines How to Respond to Risks - Risk assessment includes considering how the risk should be managed and whether to accept, avoid, reduce, or share the risk. Additional points of focus specifically related to all engagements using the trust services criteria: Identifies and Assesses Criticality of Information Assets and Identifies Threats and Vulnerabilities - The entity's risk identification and assessment process includes (1) identifying information assets, including physical devices and systems, virtual devices, software, data and data flows, external information systems, and organizational roles; (2) assessing the criticality of those information assets; (3) identifying the threats to the assets from intentional (including malicious) and unintentional acts and environmental events; and (4) identifying the vulnerabilities of the identified assets.",4,3,"['ec2_instance_managed_by_ssm', 'ssm_managed_compliant_patching', 'guardduty_no_high_severity_findings', 'guardduty_is_enabled']","['ssm', 'guardduty', 'ec2']",
soc2_aws,,cc_3_3,CC3.3 COSO Principle 8: The entity considers the potential for fraud in assessing risks to the achievement of objectives,"Considers Various Types of Fraud - The assessment of fraud considers fraudulent reporting, possible loss of assets, and corruption resulting from the various ways that fraud and misconduct can occur. Assesses Incentives and Pressures - The assessment of fraud risks considers incentives and pressures. Assesses Opportunities - The assessment of fraud risk considers opportunities for unauthorized acquisition,use, or disposal of assets, altering the entity’s reporting records, or committing other inappropriate acts. Assesses Attitudes and Rationalizations - The assessment of fraud risk considers how management and other personnel might engage in or justify inappropriate actions. Additional point of focus specifically related to all engagements using the trust services criteria: Considers the Risks Related to the Use of IT and Access to Information - The assessment of fraud risks includes consideration of threats and vulnerabilities that arise specifically from the use of IT and access to information.",5,2,"['iam_inline_policy_allows_privilege_escalation', 'iam_policy_no_full_access_to_cloudtrail', 'cloudtrail_threat_detection_privilege_escalation', 'cloudtrail_threat_detection_enumeration', 'cloudtrail_threat_detection_llm_jacking']","['iam', 'cloudtrail']",
soc2_aws,,cc_4_2,"CC4.2 COSO Principle 17: The entity evaluates and communicates internal control deficiencies in a timely manner to those parties responsible for taking corrective action, including senior management and the board of directors, as appropriate","Assesses Results - Management and the board of directors, as appropriate, assess results of ongoing and separate evaluations. Communicates Deficiencies - Deficiencies are communicated to parties responsible for taking corrective action and to senior management and the board of directors, as appropriate. Monitors Corrective Action - Management tracks whether deficiencies are remedied on a timely basis.",2,1,"['guardduty_is_enabled', 'guardduty_no_high_severity_findings']",['guardduty'],
soc2_aws,,cc_5_2,CC5.2 COSO Principle 11: The entity also selects and develops general control activities over technology to support the achievement of objectives,"Determines Dependency Between the Use of Technology in Business Processes and Technology General Controls - Management understands and determines the dependency and linkage between business processes, automated control activities, and technology general controls. Establishes Relevant Technology Infrastructure Control Activities - Management selects and develops control activities over the technology infrastructure, which are designed and implemented to help ensure the completeness, accuracy, and availability of technology processing. Establishes Relevant Security Management Process Controls Activities - Management selects and develops control activities that are designed and implemented to restrict technology access rights to authorized users commensurate with their job responsibilities and to protect the entity’s assets from external threats. Establishes Relevant Technology Acquisition, Development, and Maintenance Process Control Activities - Management selects and develops control activities over the acquisition, development, and maintenance of technology and its infrastructure to achieve management’s objectives.",10,1,"['cloudwatch_changes_to_network_acls_alarm_configured', 'cloudwatch_changes_to_network_gateways_alarm_configured', 'cloudwatch_changes_to_network_route_tables_alarm_configured', 'cloudwatch_changes_to_vpcs_alarm_configured', 'cloudwatch_log_metric_filter_and_alarm_for_aws_config_configuration_changes_enabled', 'cloudwatch_log_metric_filter_and_alarm_for_cloudtrail_configuration_changes_enabled', 'cloudwatch_log_metric_filter_aws_organizations_changes', 'cloudwatch_log_metric_filter_for_s3_bucket_policy_changes', 'cloudwatch_log_metric_filter_policy_changes', 'cloudwatch_log_metric_filter_security_group_changes']",['cloudwatch'],
soc2_aws,,cc_6_3,"CC6.3 The entity authorizes, modifies, or removes access to data, software, functions, and other protected information assets based on roles, responsibilities, or the system design and changes, giving consideration to the concepts of least privilege and segregation of duties, to meet the entity’s objectives",Creates or Modifies Access to Protected Information Assets - Processes are in place to create or modify access to protected information assets based on authorization from the asset’s owner. Removes Access to Protected Information Assets - Processes are in place to remove access to protected information assets when an individual no longer requires access. Uses Role-Based Access Controls - Role-based access control is utilized to support segregation of incompatible functions.,3,1,"['iam_aws_attached_policy_no_administrative_privileges', 'iam_customer_attached_policy_no_administrative_privileges', 'iam_inline_policy_no_administrative_privileges']",['iam'],
