compliance_name,unique_key,id,name,description,check_count,service_count,check_functions_str,services_str,applied_services
nist_800_53_revision_4_aws,nist_800_53_revision_4_gen_001_ia_2_11,ia_2_11,IA-2(11) Remote Access - Separate Device,The information system implements multifactor authentication for remote access to privileged and non-privileged accounts such that one of the factors is provided by a device separate from the system gaining access and the device meets [Assignment: organization-defined strength of mechanism requirements].,4,1,"['iam_root_hardware_mfa_enabled', 'iam_root_mfa_enabled', 'iam_user_mfa_enabled_console_access', 'iam_user_mfa_enabled_console_access']",['iam'],
nist_800_53_revision_4_aws,nist_800_53_revision_4_gen_001_ir_4_1,ir_4_1,IR-4(1) Automated Incident Handling Processes,The organization employs automated mechanisms to support the incident handling process.,5,2,"['cloudwatch_changes_to_network_acls_alarm_configured', 'cloudwatch_changes_to_network_gateways_alarm_configured', 'cloudwatch_changes_to_network_route_tables_alarm_configured', 'cloudwatch_changes_to_vpcs_alarm_configured', 'guardduty_no_high_severity_findings']","['guardduty', 'cloudwatch']",
nist_800_53_revision_4_aws,nist_800_53_revision_4_gen_001_ra_5,ra_5,Vulnerability Scanning (RA-5),Scan for system vulnerabilities. Share vulnerability information and security controls that eliminate vulnerabilities.,2,1,"['guardduty_is_enabled', 'guardduty_no_high_severity_findings']",['guardduty'],
nist_800_53_revision_4_aws,nist_800_53_revision_4_gen_001_sa_10,sa_10,Developer Configuration Management (SA-10),"The organization requires the developer of the information system, system component, or information system service to: a. Perform configuration management during system, component, or service [Selection (one or more): design; development; implementation; operation]; b. Document, manage, and control the integrity of changes to [Assignment: organization-defined configuration items under configuration management]; c. Implement only organization-approved changes to the system, component, or service; d. Document approved changes to the system, component, or service and the potential security impacts of such changes; and e. Track security flaws and flaw resolution within the system, component, or service and report findings to [Assignment: organization-defined personnel].",4,3,"['ec2_instance_managed_by_ssm', 'guardduty_is_enabled', 'guardduty_no_high_severity_findings', 'securityhub_enabled']","['guardduty', 'ec2', 'securityhub']",
nist_800_53_revision_4_aws,nist_800_53_revision_4_gen_001_sc_2,sc_2,Application Partitioning (SC-2),The information system separates user functionality (including user interface services) from information system management functionality.,3,1,"['iam_aws_attached_policy_no_administrative_privileges', 'iam_customer_attached_policy_no_administrative_privileges', 'iam_inline_policy_no_administrative_privileges']",['iam'],
nist_800_53_revision_4_aws,nist_800_53_revision_4_gen_001_sc_5,sc_5,Denial Of Service Protection (SC-5),The information system protects against or limits the effects of the following types of denial of service attacks: [Assignment: organization-defined types of denial of service attacks or references to sources for such information] by employing [Assignment: organization-defined security safeguards].,2,1,"['rds_instance_deletion_protection', 'rds_instance_multi_az']",['rds'],
nist_800_53_revision_4_aws,nist_800_53_revision_4_gen_001_sc_7_3,sc_7_3,SC-7(3) Access Points,The organization limits the number of external network connections to the information system.,16,7,"['ec2_ebs_public_snapshot', 'ec2_instance_public_ip', 'emr_cluster_master_nodes_no_public_ip', 'awslambda_function_not_publicly_accessible', 'awslambda_function_url_public', 'rds_instance_no_public_access', 'rds_snapshots_public_access', 'redshift_cluster_public_access', 's3_bucket_public_access', 's3_bucket_policy_public_write_access', 's3_account_level_public_access_blocks', 'sagemaker_notebook_instance_without_direct_internet_access_configured', 'ec2_securitygroup_default_restrict_traffic', 'ec2_networkacl_allow_ingress_any_port', 'ec2_securitygroup_allow_ingress_from_internet_to_tcp_port_22', 'ec2_networkacl_allow_ingress_any_port']","['ec2', 's3', 'emr', 'sagemaker', 'awslambda', 'redshift', 'rds']",
nist_800_53_revision_4_aws,nist_800_53_revision_4_gen_001_sc_7,sc_7,Boundary Protection (SC-7),The information system: a. Monitors and controls communications at the external boundary of the system and at key internal boundaries within the system; b. Implements subnetworks for publicly accessible system components that are [Selection: physically; logically] separated from internal organizational networks; and c. Connects to external networks or information systems only through managed interfaces consisting of boundary protection devices arranged in accordance with an organizational security architecture.,20,10,"['ec2_ebs_public_snapshot', 'ec2_instance_public_ip', 'elbv2_waf_acl_attached', 'elb_ssl_listeners', 'emr_cluster_master_nodes_no_public_ip', 'opensearch_service_domains_node_to_node_encryption_enabled', 'awslambda_function_not_publicly_accessible', 'awslambda_function_url_public', 'rds_instance_no_public_access', 'rds_snapshots_public_access', 'redshift_cluster_public_access', 's3_bucket_secure_transport_policy', 's3_bucket_public_access', 's3_bucket_policy_public_write_access', 's3_account_level_public_access_blocks', 'sagemaker_notebook_instance_without_direct_internet_access_configured', 'ec2_securitygroup_default_restrict_traffic', 'ec2_networkacl_allow_ingress_any_port', 'ec2_securitygroup_allow_ingress_from_internet_to_tcp_port_22', 'ec2_networkacl_allow_ingress_any_port']","['opensearch', 'elbv2', 'redshift', 's3', 'elb', 'emr', 'sagemaker', 'awslambda', 'ec2', 'rds']",
nist_800_53_revision_4_aws,nist_800_53_revision_4_gen_001_sc_8_1,sc_8_1,SC-8(1) Cryptographic Or Alternate Physical Protection,The information system implements cryptographic mechanisms to [Selection (one or more): prevent unauthorized disclosure of information; detect changes to information] during transmission unless otherwise protected by [Assignment: organization-defined alternative physical safeguards].,3,3,"['elb_ssl_listeners', 'opensearch_service_domains_node_to_node_encryption_enabled', 's3_bucket_secure_transport_policy']","['s3', 'opensearch', 'elb']",
nist_800_53_revision_4_aws,nist_800_53_revision_4_gen_001_sc_8,sc_8,Transmission Confidentiality And Integrity (SC-8),The information system protects the [Selection (one or more): confidentiality; integrity] of transmitted information.,3,3,"['elb_ssl_listeners', 'opensearch_service_domains_node_to_node_encryption_enabled', 's3_bucket_secure_transport_policy']","['s3', 'opensearch', 'elb']",
nist_800_53_revision_4_aws,nist_800_53_revision_4_gen_001_sc_12,sc_12,Cryptographic Key Establishment And Management (SC-12),"The organization establishes and manages cryptographic keys for required cryptography employed within the information system in accordance with [Assignment: organization-defined requirements for key generation, distribution, storage, access, and destruction].",2,2,"['acm_certificates_expiration_check', 'kms_cmk_rotation_enabled']","['acm', 'kms']",
nist_800_53_revision_4_aws,nist_800_53_revision_4_gen_001_sc_28,sc_28,Protection Of Information At Rest (SC-28),The information system protects the [Selection (one or more): confidentiality; integrity] of [Assignment: organization-defined information at rest].,12,10,"['cloudtrail_kms_encryption_enabled', 'ec2_ebs_volume_encryption', 'ec2_ebs_default_encryption', 'efs_encryption_at_rest_enabled', 'opensearch_service_domains_encryption_at_rest_enabled', 'cloudwatch_log_group_kms_encryption_enabled', 'rds_instance_storage_encrypted', 'rds_instance_storage_encrypted', 'redshift_cluster_audit_logging', 's3_bucket_default_encryption', 'sagemaker_notebook_instance_encryption_enabled', 'sns_topics_kms_encryption_at_rest_enabled']","['opensearch', 'efs', 'sns', 'redshift', 's3', 'cloudwatch', 'sagemaker', 'ec2', 'rds', 'cloudtrail']",
nist_800_53_revision_4_aws,nist_800_53_revision_4_gen_001_si_2_2,si_2_2,SI-2(2) Automates Flaw Remediation Status,The organization employs automated mechanisms to determine the state of information system components with regard to flaw remediation.,3,2,"['ec2_instance_managed_by_ssm', 'ssm_managed_compliant_patching', 'ssm_managed_compliant_patching']","['ssm', 'ec2']",
nist_800_53_revision_4_aws,nist_800_53_revision_4_gen_001_si_4_2,si_4_2,SI-4(2) Automated Tools For Real-Time Analysis,The organization employs automated tools to support near real-time analysis of events.,8,5,"['cloudtrail_cloudwatch_logging_enabled', 'cloudwatch_changes_to_network_acls_alarm_configured', 'cloudwatch_changes_to_network_gateways_alarm_configured', 'cloudwatch_changes_to_network_route_tables_alarm_configured', 'cloudwatch_changes_to_vpcs_alarm_configured', 'ec2_instance_imdsv2_enabled', 'guardduty_is_enabled', 'securityhub_enabled']","['guardduty', 'securityhub', 'cloudwatch', 'ec2', 'cloudtrail']",
nist_800_53_revision_4_aws,nist_800_53_revision_4_gen_001_si_4_4,si_4_4,SI-4(4) Inbound and Outbound Communications Traffic,The information system monitors inbound and outbound communications traffic continuously for unusual or unauthorized activities or conditions.,7,4,"['cloudtrail_cloudwatch_logging_enabled', 'cloudwatch_changes_to_network_acls_alarm_configured', 'cloudwatch_changes_to_network_gateways_alarm_configured', 'cloudwatch_changes_to_network_route_tables_alarm_configured', 'cloudwatch_changes_to_vpcs_alarm_configured', 'guardduty_is_enabled', 'securityhub_enabled']","['guardduty', 'cloudwatch', 'securityhub', 'cloudtrail']",
nist_800_53_revision_4_aws,nist_800_53_revision_4_gen_001_si_4_5,si_4_5,SI-4(5) System-Generated Alerts,The information system alerts organization-defined personnel or roles when the following indications of compromise or potential compromise occur: [Assignment: organization-defined compromise indicators].,7,4,"['cloudtrail_cloudwatch_logging_enabled', 'cloudwatch_changes_to_network_acls_alarm_configured', 'cloudwatch_changes_to_network_gateways_alarm_configured', 'cloudwatch_changes_to_network_route_tables_alarm_configured', 'cloudwatch_changes_to_vpcs_alarm_configured', 'guardduty_is_enabled', 'securityhub_enabled']","['guardduty', 'cloudwatch', 'securityhub', 'cloudtrail']",
nist_800_53_revision_4_aws,nist_800_53_revision_4_gen_001_si_4_16,si_4_16,SI-4(16) Correlate Monitoring Information,The organization correlates information from monitoring tools employed throughout the information system.,2,2,"['guardduty_is_enabled', 'securityhub_enabled']","['guardduty', 'securityhub']",
nist_800_53_revision_4_aws,nist_800_53_revision_4_gen_001_si_4,si_4,Information System Monitoring (SI-4),"The organization: a.Monitors the information system to detect: 1. Attacks and indicators of potential attacks in accordance with [Assignment: organization-defined monitoring objectives]; and 2.Unauthorized local, network, and remote connections; b. Identifies unauthorized use of the information system through [Assignment: organization-defined techniques and methods]; c. Deploys monitoring devices: 1. Strategically within the information system to collect organization-determined essential information; and 2. At ad hoc locations within the system to track specific types of transactions of interest to the organization; d. Protects information obtained from intrusion-monitoring tools from unauthorized access, modification, and deletion; e. Heightens the level of information system monitoring activity whenever there is an indication of increased risk to organizational operations and assets, individuals, other organizations, or the Nation based on law enforcement information, intelligence information, or other credible sources of information; f. Obtains legal opinion with regard to information system monitoring activities in accordance with applicable federal laws, Executive Orders, directives, policies, or regulations; and g. Provides [Assignment: organization-defined information system monitoring information] to [Assignment: organization-defined personnel or roles] [Selection (one or more): as needed; [Assignment: organization-defined frequency]].",10,6,"['cloudtrail_cloudwatch_logging_enabled', 'cloudwatch_changes_to_network_acls_alarm_configured', 'cloudwatch_changes_to_network_gateways_alarm_configured', 'cloudwatch_changes_to_network_route_tables_alarm_configured', 'cloudwatch_changes_to_vpcs_alarm_configured', 'ec2_instance_imdsv2_enabled', 'elbv2_waf_acl_attached', 'guardduty_is_enabled', 'guardduty_no_high_severity_findings', 'securityhub_enabled']","['elbv2', 'guardduty', 'securityhub', 'cloudwatch', 'ec2', 'cloudtrail']",
nist_800_53_revision_4_aws,nist_800_53_revision_4_gen_001_si_7_1,si_7_1,SI-7(1) Integrity Checks,The information system performs an integrity check of security relevant events at least monthly.,3,3,"['cloudtrail_log_file_validation_enabled', 'ec2_instance_managed_by_ssm', 'ssm_managed_compliant_patching']","['ssm', 'ec2', 'cloudtrail']",
nist_800_53_revision_4_aws,nist_800_53_revision_4_gen_001_si_12,si_12,Information Handling and Retention (SI-12),"The organization handles and retains information within the information system and information output from the system in accordance with applicable federal laws, Executive Orders, directives, policies, regulations, standards, and operational requirements.",6,5,"['cloudwatch_log_group_retention_policy_specific_days_enabled', 'dynamodb_tables_pitr_enabled', 'efs_have_backup_enabled', 'rds_instance_backup_enabled', 'rds_instance_backup_enabled', 's3_bucket_object_versioning']","['efs', 's3', 'cloudwatch', 'dynamodb', 'rds']",
nist_800_53_revision_5_aws,nist_800_53_revision_5_gen_001_ac_2_1,ac_2_1,AC-2(1) Automated System Account Management,Support the management of system accounts using [Assignment: organization-defined automated mechanisms].,14,2,"['iam_password_policy_minimum_length_14', 'iam_policy_attached_only_to_group_or_roles', 'iam_aws_attached_policy_no_administrative_privileges', 'iam_customer_attached_policy_no_administrative_privileges', 'iam_inline_policy_no_administrative_privileges', 'iam_root_hardware_mfa_enabled', 'iam_root_mfa_enabled', 'iam_no_root_access_key', 'iam_rotate_access_key_90_days', 'iam_user_mfa_enabled_console_access', 'iam_user_mfa_enabled_console_access', 'iam_user_accesskey_unused', 'iam_user_console_access_unused', 'secretsmanager_automatic_rotation_enabled']","['iam', 'secretsmanager']",
nist_800_53_revision_5_aws,nist_800_53_revision_5_gen_001_ac_2_3_a,ac_2_3_a,AC-2(3)(a),Support the management of system accounts using [Assignment: organization-defined automated mechanisms].,3,1,"['iam_password_policy_minimum_length_14', 'iam_user_accesskey_unused', 'iam_user_console_access_unused']",['iam'],
nist_800_53_revision_5_aws,nist_800_53_revision_5_gen_001_ac_2_3_b,ac_2_3_b,AC-2(3)(b),Disable accounts within [Assignment: organization-defined time period] when the accounts: (b) Are no longer associated with a user or individual.,3,1,"['iam_password_policy_minimum_length_14', 'iam_user_accesskey_unused', 'iam_user_console_access_unused']",['iam'],
nist_800_53_revision_5_aws,nist_800_53_revision_5_gen_001_ac_2_3_c,ac_2_3_c,AC-2(3)(c),Disable accounts within [Assignment: organization-defined time period] when the accounts: (c) Are in violation of organizational policy.,3,1,"['iam_password_policy_minimum_length_14', 'iam_user_accesskey_unused', 'iam_user_console_access_unused']",['iam'],
nist_800_53_revision_5_aws,nist_800_53_revision_5_gen_001_ac_2_3_d,ac_2_3_d,AC-2(3)(d),Disable accounts within [Assignment: organization-defined time period] when the accounts: (d) Have been inactive for [Assignment: organization-defined time period].,3,1,"['iam_password_policy_minimum_length_14', 'iam_user_accesskey_unused', 'iam_user_console_access_unused']",['iam'],
nist_800_53_revision_5_aws,nist_800_53_revision_5_gen_001_ac_2_3,ac_2_3,AC-2(3) Disable Accounts,Disable accounts within [Assignment: organization-defined time period] when the accounts: (a) Have expired; (b) Are no longer associated with a user or individual; (c) Are in violation of organizational policy; or (d) Have been inactive for [Assignment: organization-defined time period].,3,1,"['iam_password_policy_minimum_length_14', 'iam_user_accesskey_unused', 'iam_user_console_access_unused']",['iam'],
nist_800_53_revision_5_aws,nist_800_53_revision_5_gen_001_ac_2_4,ac_2_4,AC-2(4) Automated Audit Actions,"Automatically audit account creation, modification, enabling, disabling, and removal actions.",8,4,"['cloudtrail_multi_region_enabled', 'cloudtrail_s3_dataevents_read_enabled', 'cloudtrail_s3_dataevents_write_enabled', 'cloudtrail_multi_region_enabled', 'cloudtrail_cloudwatch_logging_enabled', 'rds_instance_integration_cloudwatch_logs', 'redshift_cluster_audit_logging', 's3_bucket_server_access_logging_enabled']","['s3', 'redshift', 'rds', 'cloudtrail']",
nist_800_53_revision_5_aws,nist_800_53_revision_5_gen_001_ac_2_6,ac_2_6,AC-2(6) Dynamic Privilege Management,Implement [Assignment: organization-defined dynamic privilege management capabilities].,21,8,"['ec2_ebs_public_snapshot', 'ec2_instance_public_ip', 'ec2_instance_imdsv2_enabled', 'emr_cluster_master_nodes_no_public_ip', 'iam_policy_attached_only_to_group_or_roles', 'iam_aws_attached_policy_no_administrative_privileges', 'iam_customer_attached_policy_no_administrative_privileges', 'iam_inline_policy_no_administrative_privileges', 'iam_no_root_access_key', 'iam_user_accesskey_unused', 'iam_user_console_access_unused', 'awslambda_function_not_publicly_accessible', 'awslambda_function_url_public', 'rds_instance_no_public_access', 'rds_snapshots_public_access', 'redshift_cluster_public_access', 's3_bucket_public_access', 's3_bucket_policy_public_write_access', 's3_account_level_public_access_blocks', 's3_bucket_public_access', 'sagemaker_notebook_instance_without_direct_internet_access_configured']","['iam', 'redshift', 'ec2', 's3', 'emr', 'sagemaker', 'awslambda', 'rds']",
nist_800_53_revision_5_aws,nist_800_53_revision_5_gen_001_ac_2_g,ac_2_g,AC-2(g),The organization: g. Monitors the use of information system accounts.,2,1,"['iam_user_accesskey_unused', 'iam_user_console_access_unused']",['iam'],
nist_800_53_revision_5_aws,nist_800_53_revision_5_gen_001_ac_2_i_2,ac_2_i_2,AC-2(i)(2),i. Authorize access to the system based on: 2. Intended system usage.,4,1,"['iam_policy_attached_only_to_group_or_roles', 'iam_aws_attached_policy_no_administrative_privileges', 'iam_customer_attached_policy_no_administrative_privileges', 'iam_inline_policy_no_administrative_privileges']",['iam'],
nist_800_53_revision_5_aws,nist_800_53_revision_5_gen_001_ac_2_j,ac_2_j,AC-2(j),The organization: j. Reviews accounts for compliance with account management requirements [Assignment: organization-defined frequency].,2,1,"['iam_user_accesskey_unused', 'iam_user_console_access_unused']",['iam'],
nist_800_53_revision_5_aws,nist_800_53_revision_5_gen_001_ac_3,ac_3,Access Enforcement (AC-3),Enforce approved authorizations for logical access to information and system resources in accordance with applicable access control policies.,21,8,"['ec2_ebs_public_snapshot', 'ec2_instance_profile_attached', 'ec2_instance_public_ip', 'ec2_instance_imdsv2_enabled', 'emr_cluster_master_nodes_no_public_ip', 'iam_aws_attached_policy_no_administrative_privileges', 'iam_customer_attached_policy_no_administrative_privileges', 'iam_inline_policy_no_administrative_privileges', 'iam_policy_attached_only_to_group_or_roles', 'iam_user_accesskey_unused', 'iam_user_console_access_unused', 'awslambda_function_not_publicly_accessible', 'awslambda_function_url_public', 'rds_instance_no_public_access', 'rds_snapshots_public_access', 'redshift_cluster_public_access', 's3_bucket_public_access', 's3_bucket_policy_public_write_access', 's3_account_level_public_access_blocks', 's3_bucket_public_access', 'sagemaker_notebook_instance_without_direct_internet_access_configured']","['iam', 'redshift', 'ec2', 's3', 'emr', 'sagemaker', 'awslambda', 'rds']",
nist_800_53_revision_5_aws,nist_800_53_revision_5_gen_001_ac_3_1,ac_3_1,AC-3(1) Restricted Access To Privileged Functions,Employ an audited override of automated access control mechanisms under [Assignment: organization-defined conditions] by [Assignment: organization-defined roles].,8,4,"['cloudtrail_multi_region_enabled', 'cloudtrail_cloudwatch_logging_enabled', 'cloudtrail_multi_region_enabled', 'cloudtrail_s3_dataevents_read_enabled', 'cloudtrail_s3_dataevents_write_enabled', 'rds_instance_integration_cloudwatch_logs', 'redshift_cluster_audit_logging', 's3_bucket_server_access_logging_enabled']","['s3', 'redshift', 'rds', 'cloudtrail']",
nist_800_53_revision_5_aws,nist_800_53_revision_5_gen_001_ac_3_2,ac_3_2,AC-3(2) Dual Authorization,Enforce dual authorization for [Assignment: organization-defined privileged commands and/or other organization-defined actions].,4,1,"['iam_root_hardware_mfa_enabled', 'iam_root_mfa_enabled', 'iam_user_mfa_enabled_console_access', 'iam_user_mfa_enabled_console_access']",['iam'],
nist_800_53_revision_5_aws,nist_800_53_revision_5_gen_001_ac_3_3,ac_3_3,AC-3(3) Mandatory Access Control,"Enforce [Assignment: organization-defined mandatory access control policy] over the set of covered subjects and objects specified in the policy, and where the policy: (a) Is uniformly enforced across the covered subjects and objects within the system; (b) Specifies that a subject that has been granted access to information is constrained from doing any of the following; (1) Passing the information to unauthorized subjects or objects; (2) Granting its privileges to other subjects; (3) Changing one or more security attributes (specified by the policy) on subjects, objects, the system, or system components; (4) Choosing the security attributes and attribute values (specified by the policy) to be associated with newly created or modified objects; and (5) Changing the rules governing access control; and (c) Specifies that [Assignment: organization-defined subjects] may explicitly be granted [Assignment: organization-defined privileges] such that they are not limited by any defined subset (or all) of the above constraints.",15,3,"['ec2_instance_imdsv2_enabled', 'iam_password_policy_minimum_length_14', 'iam_policy_attached_only_to_group_or_roles', 'iam_aws_attached_policy_no_administrative_privileges', 'iam_customer_attached_policy_no_administrative_privileges', 'iam_inline_policy_no_administrative_privileges', 'iam_root_hardware_mfa_enabled', 'iam_root_mfa_enabled', 'iam_no_root_access_key', 'iam_rotate_access_key_90_days', 'iam_user_mfa_enabled_console_access', 'iam_user_mfa_enabled_console_access', 'iam_user_accesskey_unused', 'iam_user_console_access_unused', 'secretsmanager_automatic_rotation_enabled']","['iam', 'ec2', 'secretsmanager']",
nist_800_53_revision_5_aws,nist_800_53_revision_5_gen_001_ac_3_3_a,ac_3_3_a,AC-3(3)(a),"Enforce [Assignment: organization-defined mandatory access policy] over the set of covered subjects and objects specified in the policy, and where the policy: (a) Is uniformly enforced across the covered subjects and objects within the system.",15,3,"['ec2_instance_imdsv2_enabled', 'iam_password_policy_minimum_length_14', 'iam_policy_attached_only_to_group_or_roles', 'iam_aws_attached_policy_no_administrative_privileges', 'iam_customer_attached_policy_no_administrative_privileges', 'iam_inline_policy_no_administrative_privileges', 'iam_root_hardware_mfa_enabled', 'iam_root_mfa_enabled', 'iam_no_root_access_key', 'iam_rotate_access_key_90_days', 'iam_user_mfa_enabled_console_access', 'iam_user_mfa_enabled_console_access', 'iam_user_accesskey_unused', 'iam_user_console_access_unused', 'secretsmanager_automatic_rotation_enabled']","['iam', 'ec2', 'secretsmanager']",
nist_800_53_revision_5_aws,nist_800_53_revision_5_gen_001_ac_3_3_b_1,ac_3_3_b_1,AC-3(3)(b)(1),"Enforce [Assignment: organization-defined mandatory access policy] over the set of covered subjects and objects specified in the policy, and where the policy: (b) Specifies that a subject that has been granted access to information is constrained from doing any of the following; (1) Passing the information to unauthorized subjects or objects.",15,3,"['ec2_instance_imdsv2_enabled', 'iam_password_policy_minimum_length_14', 'iam_policy_attached_only_to_group_or_roles', 'iam_aws_attached_policy_no_administrative_privileges', 'iam_customer_attached_policy_no_administrative_privileges', 'iam_inline_policy_no_administrative_privileges', 'iam_root_hardware_mfa_enabled', 'iam_root_mfa_enabled', 'iam_no_root_access_key', 'iam_rotate_access_key_90_days', 'iam_user_mfa_enabled_console_access', 'iam_user_mfa_enabled_console_access', 'iam_user_accesskey_unused', 'iam_user_console_access_unused', 'secretsmanager_automatic_rotation_enabled']","['iam', 'ec2', 'secretsmanager']",
